id,name,type,frameType,description,level,atk,def,race,attribute,archetype
30765615,"Ringowurm, the Dragon Guarding the Hundred Apples",Tuner Monster,effect,"If a face-up non-Effect Monster is on the field: You can Special Summon this card from your hand. During your Main Phase  if you Synchro Summoned this turn: You can banish this card from your GY; Special Summon 1 ""Hundred Apples Token"" (Wyrm/LIGHT/Level 2/ATK 100/DEF 100). The player who Summoned it can treat it as a Tuner for a Synchro Summon. You can only use each effect of ""Ringowurm  the Dragon Guarding the Hundred Apples"" once per turn.",2.0,100.0,1100.0,Dragon,LIGHT,
38815069,"Rinyan, Lightsworn Rogue",Flip Effect Monster,effect,"FLIP: Target 1 ""Lightsworn"" monster in your Graveyard; shuffle that target into your Deck  then draw 1 card.",2.0,100.0,100.0,Beast,LIGHT,Lightsworn
56655675,Ritual Beast Ulti-Gaiapelio,Fusion Monster,fusion,"1 ""Ritual Beast Ulti"" monster + 1 ""Ritual Beast Tamer"" monster + 1 ""Spiritual Beast"" monster Must be Special Summoned (from your Extra Deck) by banishing the above cards you control  and cannot be Special Summoned by other ways. (You do not use ""Polymerization"".) If Summoned this way  this card gains this effect. ● During either player's turn  when a Spell/Trap Card  or monster effect  is activated: You can banish 1 ""Ritual Beast"" card from your hand; negate the activation  and if you do  destroy it.",10.0,3200.0,2100.0,Psychic,LIGHT,Ritual Beast
71971554,Road Synchron,Tuner Monster,effect,"When using this card as Synchro Material for the Synchro Summon of a monster other than ""Road Warrior""  reduce this card's Level by 2. If this card attacks  at the end of the Damage Step: Increase its Level by 1 until the end of this turn.",4.0,1600.0,800.0,Machine,LIGHT,Synchron
2322421,Road Warrior,Synchro Monster,synchro,"""Road Synchron"" + 2 or more non-Tuner monsters Once per turn: You can Special Summon 1 Level 2 or lower Warrior or Machine-Type monster from your Deck.",8.0,3000.0,1500.0,Warrior,LIGHT,
46354113,Rocket Hermos Cannon,Fusion Monster,fusion,"Must be Special Summoned with ""The Claw of Hermos""  using a Warrior monster. If this card is Special Summoned: Target 1 other face-up monster on the field; equip this card to it. It can make a second attack during each Battle Phase  also  if it attacks a Defense Position monster  inflict piercing battle damage to your opponent.",4.0,1500.0,1300.0,Warrior,LIGHT,Legendary Knight
30860696,Rocket Warrior,Effect Monster,effect,During your Battle Phase  this card cannot be destroyed by battle and you take no battle damage from attacks involving this card. If this card attacks a monster  after damage calculation: That attack target loses 500 ATK until the end of this turn.,4.0,1500.0,1300.0,Warrior,LIGHT,
91939608,Rogue Doll,Normal Monster,normal,A deadly doll gifted with mystical power  it is particularly powerful when attacking against dark forces.,4.0,1600.0,1000.0,Spellcaster,LIGHT,
46303688,Roulette Barrel,Effect Monster,effect,Once per turn: You can roll a six-sided die twice  choose 1 result  and destroy 1 monster on the field whose Level is equal to that result.,4.0,1000.0,2000.0,Machine,LIGHT,
68280530,Royal Knight,Effect Monster,effect,When this card destroys a monster by battle and sends it to the Graveyard  gain Life Points equal to the DEF of the destroyed monster.,3.0,1300.0,800.0,Fairy,LIGHT,
70791313,Royal Magical Library,Effect Monster,effect,Each time a Spell Card is activated  place 1 Spell Counter on this card when that Spell resolves (max. 3). You can remove 3 Spell Counters from this card; draw 1 card.,4.0,0.0,2000.0,Spellcaster,LIGHT,
11020863,Royal Straight Slasher,Effect Monster,effect,"Cannot be Normal Summoned/Set. Must be Special Summoned with ""Royal Straight"". If you have all of ""Queen's Knight""  ""King's Knight""  and ""Jack's Knight"" in your GY: You can send 5 monsters  with different Levels of 1  2  3  4  and 5  from your hand and/or Deck to the GY  and if you do  destroy all cards your opponent controls. When this card is destroyed by battle: You can target up to 3 LIGHT Warrior monsters in your GY; Special Summon them. You can only use each effect of ""Royal Straight Slasher"" once per turn.",6.0,2400.0,1350.0,Warrior,LIGHT,
29107423,Ruddy Rose Witch,Tuner Monster,effect,"You can Tribute this card; add 1 ""Witch of the Black Rose"" from your Deck to your hand  and if you do  take 1 Level 3 or lower Plant monster from your Deck and place it on top of your Deck  then immediately after this effect resolves  you can Normal Summon 1 ""Witch of the Black Rose"" from your hand. You can banish this card from your GY; return 1 of your ""Black Rose Dragon"" or ""Ruddy Rose Dragon"" that is banished or in your GY to the Extra Deck. You can only use each effect of ""Ruddy Rose Witch"" once per turn.",1.0,800.0,1700.0,Plant,LIGHT,Rose
50139096,"Ruin, Angel of Oblivion",Ritual Effect Monster,ritual,"You can Ritual Summon this card with ""Cycle of the World"". This card's name becomes ""Ruin  Queen of Oblivion"" while in the hand or on the field. If this card is Ritual Summoned: It can make up to 2 attacks on monsters during each Battle Phase this turn. If this card is sent to the GY: You can target 1 Ritual Monster you control; while it is face-up on your field  your opponent cannot activate cards or effects when your Ritual Monsters declare an attack.",4.0,1700.0,1000.0,Fairy,LIGHT,Demise
46427957,"Ruin, Queen of Oblivion",Ritual Effect Monster,ritual,"You can Ritual Summon this card with ""End of the World"". When this attacking card destroys an opponent's monster by battle: You can activate this effect; this card can make a second attack in a row.",8.0,2300.0,2000.0,Fairy,LIGHT,Demise
13518809,"Ruin, Supreme Queen of Oblivion",Ritual Effect Monster,ritual,"You can Ritual Summon this card with ""Cycle of the World"". This card's name becomes ""Ruin  Queen of Oblivion"" while in the hand or on the field. While this Ritual Summoned card is on the field  Ritual Monsters you control cannot be destroyed by card effects. If all monsters used to Ritual Summon this card were Ritual Monsters  it can make a second attack during each Battle Phase. If this card destroys an opponent's monster by battle: You can inflict damage to your opponent equal to that destroyed monster's original ATK.",10.0,2900.0,3000.0,Fairy,LIGHT,Demise
21502796,"Ryko, Lightsworn Hunter",Flip Effect Monster,effect,FLIP: Apply these effects (simultaneously).  ● You can destroy 1 card on the field.  ● Send the top 3 cards of your Deck to the GY.,2.0,200.0,100.0,Beast,LIGHT,Lightsworn
63737050,Ryu Okami,Effect Monster,effect,If your opponent Special Summons a monster(s): Your opponent sends 1 card from their Extra Deck to the Graveyard.,8.0,2900.0,1200.0,Wyrm,LIGHT,
65479980,S-Force Dog Tag,Effect Monster,effect,"During your Main Phase  your opponent cannot activate the effects of monsters in the same column as one of your ""S-Force"" monsters. If your opponent Normal or Special Summons a monster(s) while you control an ""S-Force"" monster (except during the Damage Step): You can Special Summon this card from your hand. You can only use this effect of ""S-Force Dog Tag"" once per turn.",5.0,1600.0,2100.0,Machine,LIGHT,S-Force
21368442,S-Force Gravitino,Effect Monster,effect,"Each of your opponent's monsters in the same column as one of your ""S-Force"" monsters is banished when it leaves the field. If this card is Normal or Special Summoned: You can add 1 ""S-Force"" card from your Deck to your hand  except ""S-Force Gravitino"". You can only use this effect of ""S-Force Gravitino"" once per turn.",5.0,2000.0,1400.0,Psychic,LIGHT,S-Force
35334193,S-Force Justify,Link Monster,link,"3 Effect Monsters  including an ""S-Force"" monster  You cannot Summon/Set monsters to a zone(s) this card points to. (Quick Effect): You can target 1 face-up Effect Monster your opponent controls; negate its effects until the end of this turn  then you can move that opponent's monster to their Monster Zone this card points to. You can only use this effect of ""S-Force Justify"" once per turn. At the start of the Damage Step  if this card attacks: You can banish all monsters this card points to.",,2600.0,,Cyberse,LIGHT,S-Force
27383719,S-Force Lapcewell,Effect Monster,effect,"If this card is Special Summoned: You can target 1 ""S-Force"" monster in your GY  except ""S-Force Lapcewell""; Special Summon it. You can banish 1 ""S-Force"" card from your hand; destroy all of your opponent's monsters in the same columns as your ""S-Force"" monsters. You can only use each effect of ""S-Force Lapcewell"" once per turn.",6.0,2400.0,2500.0,Fiend,LIGHT,S-Force
95974848,S-Force Orrafist,Effect Monster,effect,"Your opponent cannot target any of their monsters in the same column as one of your ""S-Force"" monsters with card effects. When a monster your opponent controls activates its effect (Quick Effect): You can banish 1 ""S-Force"" card from your hand; destroy that monster. You can only use this effect of ""S-Force Orrafist"" once per turn.",4.0,1800.0,1000.0,Cyberse,LIGHT,S-Force
53782828,S-Force Retroactive,Effect Monster,effect,"If a monster you control would be used as Link Material for an ""S-Force"" monster  this card in your hand can also be used as material. During the Main Phase (Quick Effect): You can return this card to the hand  and if you do  Special Summon 1 Level 2 or higher ""S-Force"" monster from your hand. If an ""S-Force"" monster you control would banish a card(s) from your hand to activate its effect  you can banish this card from your GY instead. You can only use each effect of ""S-Force Retroactive"" once per turn.",1.0,0.0,0.0,Warrior,LIGHT,S-Force
16261341,Sacred Arch-Airknight Parshath,Effect Monster,effect,"If you activate a Counter Trap Card  OR if you negate the activation of a Spell/Trap Card  or monster effect (except during the Damage Step): You can banish 2 other Fairy monsters from your hand  field and/or GY; Special Summon this card from the GY (if it was there when you activated/negated) or hand (even if not). If this card attacks a Defense Position monster  inflict piercing battle damage. When this card inflicts battle damage to your opponent: You can add 1 ""Parshath"" card or 1 Counter Trap from your Deck to your hand.",9.0,2800.0,2300.0,Fairy,LIGHT,Parshath
30914564,Sacred Crane,Effect Monster,effect,If this card is Special Summoned: Draw 1 card.,4.0,1600.0,400.0,Winged Beast,LIGHT,
10613952,Sacred Noble Knight of King Artorigus,XYZ Monster,xyz,"2 Level 5 ""Noble Knight"" monsters  When this card is Xyz Summoned: You can target up to 3 ""Noble Arms"" Equip Spell Cards with different names in your Graveyard; equip those targets to this card. Once per turn: You can detach 1 Xyz Material from this card  then target 1 other monster on the field; destroy that target. If this card is sent from the field to the Graveyard: You can target 1 Level 4 or higher ""Noble Knight"" monster in your Graveyard; Special Summon that target.",5.0,2200.0,2200.0,Warrior,LIGHT,Noble Knight
78876707,Sacred Noble Knight of King Custennin,XYZ Monster,xyz,"2+ Level 4 ""Noble Knight"" monsters  You can detach any number of materials from this card  then target that many cards your opponent controls; return them to the hand. If this card is destroyed by battle or card effect and sent to the GY: You can Special Summon 1 ""Noble Knight"" Xyz Monster from your Extra Deck  except ""Sacred Noble Knight of King Custennin""  and if you do  attach this card from the GY to that monster as material. (This is treated as an Xyz Summon.) You can only use each effect of ""Sacred Noble Knight of King Custennin"" once per turn.",4.0,1500.0,2500.0,Warrior,LIGHT,Noble Knight
56350972,"Saffira, Queen of Dragons",Ritual Effect Monster,ritual,"You can Ritual Summon this card with ""Hymn of Light"". During the End Phase  if this card was Ritual Summoned this turn  or if a LIGHT monster was sent from the hand or Deck to the Graveyard this turn while this card was face-up on the field: You can activate 1 of these effects; ● Draw 2 cards  then discard 1 card. ● Discard 1 random card from your opponent's hand. ● Add 1 LIGHT monster from your Graveyard to your hand. You can only use 1 ""Saffira  Queen of Dragons"" effect per turn  and only once that turn.",6.0,2500.0,2400.0,Dragon,LIGHT,
101203020,"Saffira, the Wise Silenforcer Queen",Effect Monster,effect,"You can discard this card; send 1 Ritual Spell from your Deck to the GY  then you can add 1 LIGHT Warrior or Dragon Ritual Monster from your Deck or GY to your hand. You can banish this card from your GY; Ritual Summon 1 LIGHT Warrior or Dragon Ritual Monster from your hand  by Tributing monsters from your hand or field whose total Levels equal or exceed the Level of the Ritual Monster you Ritual Summon. You can only use each effect of ""Saffira  the Wise Silenforcer Queen"" once per turn.",6.0,2500.0,2400.0,Dragon,LIGHT,Silenforc
26669055,Sage of Silence,Effect Monster,effect,If this card destroys an opponent's monster by battle  your opponent cannot activate Spell Cards during the next turn.,4.0,1400.0,1000.0,Spellcaster,LIGHT,
62054060,Sage of Stillness,Effect Monster,effect,If this card destroys an opponent's monster by battle  your opponent cannot activate Trap Cards during the next turn.,4.0,1400.0,1000.0,Spellcaster,LIGHT,
8240199,Sage with Eyes of Blue,Tuner Monster,effect,"When this card is Normal Summoned: You can add 1 Level 1 LIGHT Tuner from your Deck to your hand  except ""Sage with Eyes of Blue"". You can discard this card  then target 1 Effect Monster you control; send it to the GY  and if you do  Special Summon 1 ""Blue-Eyes"" monster from your Deck. You can only use this effect of ""Sage with Eyes of Blue"" once per turn.",1.0,0.0,1500.0,Spellcaster,LIGHT,Blue-Eyes
67972302,Sakitama,Spirit Monster,effect,"Cannot be Special Summoned. Once per turn  during the End Phase  if this card was Normal Summoned or flipped face-up this turn: Return this card to the hand. You can only use each of the following effects of ""Sakitama"" once per turn. You can reveal this card in your hand; immediately after this effect resolves  Normal Summon 1 Spirit monster from your hand. If this card is Tributed: Target 1 Spirit monster in your GY; add it to your hand.",4.0,400.0,900.0,Fairy,LIGHT,
62306203,Salvagent Driver,Effect Monster,effect,"If a Cyberse Link Monster you control is destroyed by an opponent's card effect while this card is in your hand or GY (except during the Damage Step): You can Special Summon this card. You can discard 1 Spell  then target 1 Cyberse monster in your GY; Special Summon it  but it cannot attack directly this turn. You can only use each effect of ""Salvagent Driver"" once per turn.",6.0,2200.0,2100.0,Cyberse,LIGHT,
33750025,Samsara Dragon,Effect Monster,effect,"This card can be treated as 2 Tributes for the Tribute Summon of a Dragon monster. You can banish this card from your GY  then target 1 Level 5 or higher Dragon monster in your GY; add it to your hand  then immediately after this effect resolves  you can Tribute Summon it. You can only use this effect of ""Samsara Dragon"" once per turn.",1.0,0.0,0.0,Dragon,LIGHT,
662853,Sanctity of Dragon,Link Monster,link,3+ Dragon Effect Monsters Must be Link Summoned. If this Extra Linked card attacks your opponent directly and reduces their LP to 0  you win the Match.,,3000.0,,Dragon,LIGHT,
50593156,Sand Gambler,Effect Monster,effect,Toss a coin 3 times. If all 3 results are Heads  destroy all monsters on your opponent's side of the field. If all 3 results are Tails  destroy all monsters on your side of the field. You can only activate this effect once per turn  during your Main Phase.,3.0,300.0,1600.0,Spellcaster,LIGHT,
33015627,"Sandaion, the Timelord",Effect Monster,effect,"Cannot be Special Summoned from the Deck. You can only control 1 ""Sandaion  the Timelord"". If only your opponent controls a monster  you can Normal Summon this card without Tributing. Cannot be destroyed by battle or card effects. Neither player takes battle damage from attacks involving this card. At the end of the Battle Phase  if this card battled: Inflict 2000 damage to your opponent. Once per turn  during your Standby Phase: Shuffle this card into the Deck.",10.0,4000.0,4000.0,Fairy,LIGHT,Timelord
25955164,Sanga of the Thunder,Effect Monster,effect,During damage calculation in your opponent's turn  if this card is being attacked: You can target the attacking monster; make that target's ATK 0 during damage calculation only (this is a Quick Effect). This effect can only be used once while this card is face-up on the field.,7.0,2600.0,2200.0,Thunder,LIGHT,
46565218,Santa Claws,Effect Monster,effect,You can Special Summon this card (from your hand) to your opponent's field in Defense Position  by Tributing 1 monster they control. If Summoned this way  once  during the End Phase of this turn: You can draw 1 card.,6.0,1200.0,2500.0,Fiend,LIGHT,
99801464,Sari of the Silverwing Axe,Effect Monster,effect,"(Quick Effect): You can target 1 face-up monster on the field; equip this card from your hand or field to it. It gains 100 ATK/DEF. You can only use this effect of ""Sari of the Silverwing Axe"" once per turn.",3.0,500.0,100.0,Machine,LIGHT,
77379481,Sasuke Samurai #3,Effect Monster,effect,When this card inflicts Battle Damage to your opponent's Life Points  your opponent draws cards until his/her hand has 7 cards.,3.0,1000.0,1000.0,Warrior,LIGHT,
65056481,Satellarknight Alsahm,Effect Monster,effect,"If this card is Summoned: You can inflict 1000 damage to your opponent. You can only use this effect of ""Satellarknight Alsahm"" once per turn.",4.0,1400.0,1800.0,Warrior,LIGHT,Tellarknight
2273734,Satellarknight Altair,Effect Monster,effect,"If this card is Summoned: You can target 1 ""tellarknight"" monster in your Graveyard  except ""Satellarknight Altair""; Special Summon that monster in Defense Position  also monsters you control cannot attack for the rest of this turn  except ""tellarknight"" monsters. You can only use this effect of ""Satellarknight Altair"" once per turn.",4.0,1700.0,1300.0,Warrior,LIGHT,Tellarknight
26057276,Satellarknight Betelgeuse,Effect Monster,effect,"If this card is Summoned: You can target 1 ""tellarknight"" card in your Graveyard  except ""Satellarknight Betelgeuse""; send this card to the Graveyard  and if you do  add that target to your hand. You can only use this effect of ""Satellarknight Betelgeuse"" once per turn.",4.0,700.0,1900.0,Warrior,LIGHT,Tellarknight
86466163,Satellarknight Capella,Effect Monster,effect,"If this card is Summoned: You can apply the effect below for the rest of this turn. You can only use this effect of ""Satellarknight Capella"" once per turn (but if it resolves  you can apply the effect multiple times). ● You can treat Level 4 or lower ""tellarknight"" monsters you control as Level 5 when Xyz Summoning using 3 or more monsters as Xyz Materials.",4.0,1100.0,2000.0,Warrior,LIGHT,Stellarknight
75878039,Satellarknight Deneb,Effect Monster,effect,"If this card is Summoned: You can add 1 ""tellarknight"" monster from your Deck to your hand  except ""Satellarknight Deneb"". You can only use this effect of ""Satellarknight Deneb"" once per turn.",4.0,1500.0,1000.0,Warrior,LIGHT,Tellarknight
99668578,Satellarknight Procyon,Effect Monster,effect,"If this card is Summoned: You can send 1 ""tellarknight"" monster from your hand to the Graveyard  and if you do  draw 1 card. You can only use this effect of ""Satellarknight Procyon"" once per turn.",4.0,1300.0,1200.0,Warrior,LIGHT,Tellarknight
13851202,Satellarknight Rigel,Effect Monster,effect,"If this card is Summoned: You can target 1 ""tellarknight"" monster on the field; it gains 500 ATK  but send it to the Graveyard during the End Phase. You can only use this effect of ""Satellarknight Rigel"" once per turn.",4.0,1900.0,700.0,Warrior,LIGHT,Tellarknight
63274863,Satellarknight Sirius,Effect Monster,effect,"If this card is Summoned: You can target 5 ""tellarknight"" monsters in your Graveyard; shuffle all 5 into the Deck  then draw 1 card. You can only use this effect of ""Satellarknight Sirius"" once per turn.",4.0,1600.0,900.0,Warrior,LIGHT,Tellarknight
1050186,Satellarknight Unukalhai,Effect Monster,effect,"If this card is Summoned: You can send 1 ""tellarknight"" card from your Deck to the Graveyard  except ""Satellarknight Unukalhai"". You can only use this effect of ""Satellarknight Unukalhai"" once per turn.",4.0,1800.0,1000.0,Warrior,LIGHT,Tellarknight
38667773,Satellarknight Vega,Effect Monster,effect,"If this card is Summoned: You can Special Summon 1 ""tellarknight"" monster from your hand  except ""Satellarknight Vega"". You can only use this effect of ""Satellarknight Vega"" once per turn.",4.0,1200.0,1600.0,Warrior,LIGHT,Tellarknight
96223501,Satellarknight Zefrathuban,Pendulum Effect Monster,effect_pendulum,"[ Pendulum Effect ]  You cannot Pendulum Summon monsters  except ""tellarknight"" and ""Zefra"" monsters. This effect cannot be negated. [ Monster Effect ]  If this card is Normal  Flip  or Pendulum Summoned: You can target 1 other ""tellarknight"" or ""Zefra"" card in your Monster Zone or Pendulum Zone  and 1 face-up card your opponent controls; destroy them. You can only use this effect of ""Satellarknight Zefrathuban"" once per turn.",4.0,0.0,2100.0,Warrior,LIGHT,tellarknight
50400231,Satellite Cannon,Effect Monster,effect,This card cannot be destroyed by battle with a Level 7 or lower monster. During each of your End Phases: This card gains 1000 ATK. If this card attacks  this increased ATK returns to 0  after damage calculation.,5.0,0.0,0.0,Machine,LIGHT,
4810828,"Sauravis, the Ancient and Ascended",Ritual Effect Monster,ritual,"You can Ritual Summon this card with ""Sprite's Blessing"". When your opponent activates a card or effect that targets a monster you control (Quick Effect): You can discard this card; negate the activation. When your opponent would Special Summon a monster(s) (Quick Effect): You can return this card to the hand; negate the Special Summon  and if you do  banish that monster(s).",7.0,2600.0,2800.0,Dragon,LIGHT,
101203021,"Sauravis, the Sagely Silenforcer Dragon",Effect Monster,effect,"You can Special Summon this card (from your hand) by shuffling 2 Spells from your hand and/or GY into the Deck  including at least 1 Ritual Spell. You can only Special Summon ""Sauravis  the Sagely Silenforcer Dragon"" once per turn this way. When your opponent activates a card or effect (Quick Effect): You can return this card to the hand; Special Summon 1 LIGHT Warrior or Dragon Ritual Monster from your hand or Deck  but shuffle it into the Deck during the End Phase of the next turn. You can only use this effect of ""Sauravis  the Sagely Silenforcer Dragon"" once per turn.",7.0,2600.0,2800.0,Dragon,LIGHT,Silenforc
75198893,Scanner,Effect Monster,effect,Once per turn  you can select 1 of your opponent's monsters that is removed from play. Until the End Phase  this card's name is treated as the selected monster's name  and this card has the same Attribute  Level  ATK  and DEF as the selected monster. If this card is removed from the field while this effect is applied  remove it from play.,1.0,0.0,0.0,Machine,LIGHT,
57594700,Schuberta the Melodious Maestra,Fusion Monster,fusion,"2 ""Melodious"" monsters During either player's turn: You can target up to 3 cards in any Graveyard(s); banish them  and if you do  this card gains 200 ATK for each. This effect can only be used once while this card is face-up on the field.",6.0,2400.0,2000.0,Fairy,LIGHT,Melodious
41767843,Score the Melodious Diva,Effect Monster,effect,"During damage calculation (in either player's turn)  if a ""Melodious"" monster you control battles an opponent's monster: You can send this card from your hand to the Graveyard; change that opponent's monster's ATK and DEF to 0  until the end of this turn.",2.0,200.0,200.0,Fairy,LIGHT,Melodious
67646312,Searchlightman,Flip Effect Monster,effect,FLIP: Your opponent cannot Set (or flip face-down) any cards for the rest of this turn.,3.0,1000.0,1000.0,Machine,LIGHT,
33964637,Secret Six Samurai - Rihan,Fusion Monster,fusion,"3 ""Six Samurai"" monsters with different Attributes  Must first be Special Summoned (from your Extra Deck) by sending the above cards you control to the GY. (You do not use ""Polymerization"".) Cannot be used as Fusion Material. Once per turn: You can banish 1 ""Six Samurai"" card from your hand or face-up from your field  then target 1 card on the field; banish it. If a ""Six Samurai"" monster(s) you control would be destroyed by battle or card effect  you can banish this card from your GY instead.",5.0,2400.0,2400.0,Warrior,LIGHT,Secret Six Samurai
2220237,Secure Gardna,Link Monster,link,"1 Cyberse Link Monster  After this card is Special Summoned  you take no effect damage for the rest of this turn. Once per turn  if you would take battle or effect damage  you take no damage. Cannot be used as Link Material. You can only control 1 ""Secure Gardna"".",,1000.0,,Cyberse,LIGHT,
99111753,Security Dragon,Link Monster,link,"2 monsters  Once while face-up on the field  if this card is co-linked: You can target 1 monster your opponent controls; return it to the hand. You can only use this effect of ""Security Dragon"" once per turn.",,1100.0,,Cyberse,LIGHT,
93104633,Security Token,Token,token,"This card can be used as a ""Security Token"".      ● If used for another Token  apply that Token's Type / Attribute / Level / ATK / DEF.",4.0,2000.0,2000.0,Cyberse,LIGHT,
