id,name,type,frameType,description,level,atk,def,race,attribute,archetype
3715284,Meklord Army Deployer Obbligato,Effect Monster,effect,"During your Main Phase: You can activate this effect; destroy this card  and if you do  Special Summon 2 ""Meklord Army"" monsters from your Deck in Defense Position  except ""Meklord Army Deployer Obbligato""  also you cannot Special Summon monsters for the rest of this turn  except Machine monsters. If this card is sent to the GY: You can activate this effect; during the End Phase of this turn  you can inflict 100 damage to your opponent for each ""Meklord"" monster you control. You can only use each effect of ""Meklord Army Deployer Obbligato"" once per turn.",4.0,1200.0,1800.0,Machine,LIGHT,Meklord
63468625,Meklord Astro Mekanikle,Effect Monster,effect,"Cannot be Normal Summoned/Set. Must be Special Summoned (from your hand) by sending 3 ""Meklord"" monsters from your hand to the Graveyard  and cannot be Special Summoned by other ways. Once per turn: You can target 1 Synchro Monster your opponent controls; equip that target to this card. This card gains ATK equal to the combined ATK of the monsters equipped to it by this effect. Once per turn  during your Standby Phase: You can send 1 of these equipped monsters you control to the Graveyard; inflict damage to your opponent equal to that monster's original ATK. You cannot conduct your Battle Phase the turn you activate this effect.",12.0,4000.0,4000.0,Machine,LIGHT,Meklord
88942504,Melomelody the Brass Djinn,XYZ Monster,xyz,"2 Level 3 monsters Once per turn: You can detach 1 Xyz Material from this card  then target 1 ""Djinn"" Xyz Monster you control; it can make a second attack during each Battle Phase this turn.",3.0,1400.0,1600.0,Fiend,LIGHT,Djinn
49905576,"Meltiel, Sage of the Sky",Effect Monster,effect,"Each time a Counter Trap Card is activated  immediately after it resolves  gain 1000 LP  and if you do  if ""The Sanctuary in the Sky"" is on the field  destroy 1 card your opponent controls.",4.0,1600.0,1200.0,Fairy,LIGHT,
81945676,Memento Mace,Effect Monster,effect,"During your opponent's Main Phase  if you control ""Mementoral Tecuhtlica  the Netherskull Dragon"" (Quick Effect): You can discard this card  then target 1 face-up monster your opponent controls; take control of it until the End Phase. During your Main Phase: You can destroy 1 ""Memento"" monster you control  and if you do  add 1 ""Memento"" card from your Deck to your hand  except ""Memento Mace"". You can only use each effect of ""Memento Mace"" once per turn.",1.0,400.0,300.0,Fairy,LIGHT,Memento
30291086,Mental Tuner,Tuner Monster,effect,"You can activate 1 of these effects;  ● Banish up to 1 LIGHT and up to 1 DARK monster from your hand and/or GY; increase or decrease this card's Level by the exact number banished  until the end of this turn.  ● Target up to 2 of your banished monsters (1 LIGHT and/or 1 DARK); return them to the GY  and if you do  increase or decrease this card's Level by the exact number returned  until the end of this turn.  You can only use this effect of ""Mental Tuner"" once per turn.",3.0,200.0,2100.0,Psychic,LIGHT,
7200041,Metal Shooter,Effect Monster,effect,When this card is Normal Summoned  place 2 counters on it. This card gains 800 ATK for each of these counters on it. If this card would be destroyed by a card effect  remove 1 of this card's counters instead.,5.0,800.0,800.0,Machine,LIGHT,
57761191,"Metaltron XII, the True Dracombatant",Effect Monster,effect,Requires 3 Tributes to Normal Summon (cannot be Normal Set). To Tribute Summon this card face-up  you can Tribute Continuous Spell/Trap Card(s) you control  as well as monsters. Unaffected by the effects of cards with the same card type (Monster  Spell  and/or Trap) as the original card type of the cards Tributed for its Tribute Summon. If this Tribute Summoned monster in its owner's control is destroyed by an opponent's card (by battle or card effect): You can Special Summon 1 Fusion  Synchro  or Xyz Monster that is EARTH  WATER  FIRE  or WIND from your Extra Deck.,9.0,3000.0,3000.0,Wyrm,LIGHT,True Draco
89189982,Metaphys Armed Dragon,Normal Monster,normal,Usually visible despite its phantom existence.,7.0,2800.0,1000.0,Wyrm,LIGHT,Armed Dragon
45960523,Metaphys Daedalus,Effect Monster,effect,"If this card is Special Summoned by the effect of a ""Metaphys"" monster: You can banish all other face-up Special Summoned monsters on the field. If this card is banished  during the Standby Phase of the next turn: You can shuffle this banished card into the Deck; banish 1 ""Metaphys"" card from your Deck  except ""Metaphys Daedalus"".",7.0,2600.0,1500.0,Wyrm,LIGHT,Metaphys
12196873,Metaphys Decoy Dragon,Pendulum Effect Monster,effect_pendulum,"[ Pendulum Effect ]  When your monster is targeted for an attack: You can target 1 of your ""Metaphys"" monsters that is banished or in your GY; banish this card  and if you do  Special Summon that monster in Attack Position. You can only use this effect of ""Metaphys Decoy Dragon"" once per turn. [ Monster Effect ]  When your monster is targeted for an attack: You can target 1 of your ""Metaphys"" monsters that is banished or in your GY; banish this card  and if you do  Special Summon that monster in Attack Position. During the Standby Phase of the next turn after this card was banished: You can Special Summon this banished card. You can only use each effect of ""Metaphys Decoy Dragon"" once per turn.",2.0,300.0,200.0,Wyrm,LIGHT,Metaphys
45148985,Metaphys Executor,Effect Monster,effect,"Cannot be Normal Summoned/Set. Must be Special Summoned (from your hand) by banishing 5 ""Metaphys"" cards with different names from your GY and/or face-up from your field. Cannot be destroyed  or banished  by card effects. Once per turn  if your opponent controls more cards than you do: You can target 1 of your banished ""Metaphys"" monsters; Special Summon it  but banish it during the End Phase of the next turn.",10.0,3000.0,2500.0,Wyrm,LIGHT,Metaphys
36898537,Metaphys Horus,Synchro Monster,synchro,1 Tuner + 1+ non-Tuner monsters If this card is Synchro Summoned: You can activate the appropriate effect(s)  depending on the non-Tuner monster(s) used as Synchro Material; ● Normal Monster: This face-up card is unaffected by other card effects this turn. ● Effect Monster: You can target 1 other face-up card on the field; negate that target's effects. ● Pendulum Monster: Your opponent chooses 1 monster they control and gives control of it to you  but it cannot attack this turn.,6.0,2300.0,1600.0,Wyrm,LIGHT,Metaphys
72355272,Metaphys Nephthys,Effect Monster,effect,"If this card is Special Summoned by the effect of a ""Metaphys"" monster: You can banish all Set Spells and Traps on the field. If this card is banished  during the Standby Phase of the next turn: You can shuffle this banished card into the Deck; add 1 ""Metaphys"" card from your Deck to your hand  except ""Metaphys Nephthys"".",8.0,2400.0,1600.0,Wyrm,LIGHT,Metaphys
19476824,Metaphys Ragnarok,Effect Monster,effect,"If this card is Normal or Special Summoned: You can banish the top 3 cards of your Deck  and if you do  this card gains 300 ATK for each ""Metaphys"" card banished by this effect. When this card inflicts battle damage to your opponent: You can Special Summon 1 Level 5 or higher ""Metaphys"" monster from your Deck  but banish it during the End Phase of the next turn. You can only use each effect of ""Metaphys Ragnarok"" once per turn.",4.0,1500.0,1000.0,Wyrm,LIGHT,Metaphys
18743376,Metaphys Tyrant Dragon,Effect Monster,effect,"If this card was Special Summoned by the effect of a ""Metaphys"" monster  it is unaffected by Trap effects  also if it attacks a monster  it can make a second attack in a row. If this card is banished  during the Standby Phase of the next turn: You can shuffle this banished card into the Deck; Special Summon 1 ""Metaphys"" monster from your hand  but banish it during the End Phase of the next turn.",8.0,2900.0,2500.0,Wyrm,LIGHT,Metaphys
4779823,"Michael, the Arch-Lightsworn",Synchro Monster,synchro,"1 Tuner + 1 or more non-Tuner LIGHT monsters Once per turn: You can pay 1000 LP  then target 1 card on the field; banish that target. When this card is destroyed: You can target any number of other ""Lightsworn"" monsters in your Graveyard; shuffle them into the Deck  and if you do  you gain 300 LP for each returned card. Once per turn  during your End Phase: Send the top 3 cards of your Deck to the Graveyard.",7.0,2600.0,2000.0,Dragon,LIGHT,Lightsworn
33225925,Milla the Temporal Magician,Effect Monster,effect,When this card is Normal Summoned: Target 1 Set card your opponent controls; look at it. Your opponent cannot activate Spell/Trap Cards in response to this effect's activation.,4.0,1800.0,1000.0,Spellcaster,LIGHT,Magician
96782886,Mind Master,Tuner Monster,effect,"You can pay 800 Life Points and Tribute 1 Psychic-Type monster  except ""Mind Master""  to Special Summon 1 Level 4 or lower Psychic-Type monster from your Deck in face-up Attack Position.",1.0,100.0,200.0,Psychic,LIGHT,
85060248,Mind Protector,Effect Monster,effect,This card's controller must pay 500 Life Points during each of their Standby Phases. If they cannot  destroy this card. Monsters with 2000 or less ATK cannot declare an attack  except for Psychic-Type monsters.,3.0,0.0,2200.0,Psychic,LIGHT,
40164421,"Minerva, Lightsworn Maiden",Tuner Monster,effect,"When this card is Normal Summoned: You can add 1 LIGHT Dragon-Type monster from your Deck to your hand  whose Level is less than or equal to the total number of ""Lightsworn"" monsters with different names in your Graveyard. If this card is sent from the hand or Deck to the Graveyard: Send the top card of your Deck to the Graveyard. During each of your End Phases: Send the top 2 cards of your Deck to the Graveyard.",3.0,800.0,200.0,Spellcaster,LIGHT,Lightsworn
53666449,"Minerva, Scholar of the Sky",Effect Monster,effect,"Each time a Counter Trap Card is activated  immediately after it resolves  this card gains 500 ATK  and if it does  and ""The Sanctuary in the Sky"" is on the field  add 1 Counter Trap with a different name from your GY to your hand.",4.0,1700.0,400.0,Fairy,LIGHT,
30100551,"Minerva, the Exalted Lightsworn",XYZ Monster,xyz,"2 Level 4 monsters  You can detach 1 material from this card; send the top 3 cards of your Deck to the GY  then draw cards equal to the number of ""Lightsworn"" cards sent to the GY by this effect. If this card is destroyed by battle  or if this card in its owner's possession is destroyed by an opponent's card effect: You can send the top 3 cards of your Deck to the GY  then you can destroy cards on the field up to the number of ""Lightsworn"" cards sent to the GY by this effect. You can only use each effect of ""Minerva  the Exalted Lightsworn"" once per turn.",4.0,2000.0,800.0,Fairy,LIGHT,Lightsworn
60181553,Mira the Star-Bearer,XYZ Monster,xyz,3 Level 1 monsters If this face-up card would be destroyed  you can detach 1 Xyz Material from this card instead. Level 4 or lower monsters you control cannot be destroyed by card effects.,1.0,1100.0,1000.0,Warrior,LIGHT,
131182,Miracle Flipper,Effect Monster,effect,"If you control a ""Miracle Flipper""  you cannot Summon this card. Your opponent cannot select another face-up monster as an attack target. If this card is destroyed by battle  Special Summon it to your opponent's side of the field at the end of the Battle Phase. If this card is destroyed by the effect of a Spell or Trap Card  destroy 1 monster your opponent controls.",2.0,300.0,500.0,Spellcaster,LIGHT,
15960641,Mirage Dragon,Effect Monster,effect,Your opponent cannot activate Trap Cards during the Battle Phase.,4.0,1600.0,600.0,Dragon,LIGHT,
49217579,Mirage Knight,Effect Monster,effect,"Cannot be Normal Summoned/Set. Must be Special Summoned by ""Dark Flare Knight"" and cannot be Special Summoned by other ways. During damage calculation only  this card gains ATK equal to the original ATK of the opponent's monster it is battling. During the End Phase of a turn this card attacked or was attacked: Banish this card.",8.0,2800.0,2000.0,Warrior,LIGHT,
63442605,Mirage Token,Token,token,"Special Summoned with the effect of ""Physical Double"". Destroy this Token at the end of the turn.",0.0,0.0,0.0,Warrior,LIGHT,
84687358,Mirror Force Dragon,Fusion Monster,fusion,"Must be Special Summoned with ""The Fang of Critias""  using ""Mirror Force"". When a monster(s) you control is targeted for an attack or by an opponent's card effect (except during the Damage Step): You can destroy all cards your opponent controls.",8.0,2800.0,1200.0,Dragon,LIGHT,Legendary Knight
45358284,Mirror Ladybug,Effect Monster,effect,If you control at least 1 face-up monster and have no monsters in your Graveyard  you can Special Summon this card from your hand. When this card is Special Summoned this way  this card's Level becomes equal to the total Levels of all other monsters you control. If the Level of this card is higher than 12  destroy this card.,1.0,100.0,100.0,Insect,LIGHT,
40159926,Mirror Resonator,Tuner Monster,effect,"If your opponent controls a face-up monster(s) that was Special Summoned from the Extra Deck and you do not  while this card is in your hand or Graveyard: You can Special Summon this card  but banish it when it leaves the field. You can only use this effect of ""Mirror Resonator"" once per turn. Once per turn: You can target 1 face-up monster your opponent controls; treat this card's Level as that monster's original Level if this card is used for a Synchro Summon this turn.",1.0,0.0,0.0,Fiend,LIGHT,Resonator
28954097,Mirror Swordknight,Effect Monster,effect,"If this card battles a monster  neither can be destroyed by that battle. You can only use each of the following effects of ""Mirror Swordknight"" once per turn. (Quick Effect): You can Tribute this card; Special Summon 1 monster from your Deck that mentions ""Chimera Fusion""  except ""Mirror Swordknight"". When a monster your opponent controls activates its effect  while you control ""Chimera the Flying Mythical Beast"" (Quick Effect): You can banish this card from your field or GY; negate that effect.",4.0,1900.0,300.0,Illusion,LIGHT,
22404675,Mithra the Thunder Vassal,Effect Monster,effect,"If this card is in your hand: You can activate this effect; you cannot Special Summon monsters from the Extra Deck for the rest of this turn  also Special Summon this card  and if you do  Special Summon 1 ""Vassal Token"" (Thunder-Type/LIGHT/Level 1/ATK 800/DEF 1000) to your opponent's field in Defense Position. If this card is Tributed for a Tribute Summon: You can activate this effect; you can Tribute Summon 1 monster during your Main Phase this turn  in addition to your Normal Summon/Set this turn. (You can only gain this effect once per turn.) You can only use each effect of ""Mithra the Thunder Vassal"" once per turn.",2.0,800.0,1000.0,Thunder,LIGHT,Vassal
66736715,"Moissa Knight, the Comet General",Pendulum Effect Monster,effect_pendulum,[ Pendulum Effect ]  If you Pendulum Summon a monster(s): Place this card on either the top or bottom of the Deck. [ Monster Effect ]  When you draw this card: You can reveal it; during your Main Phase this turn  you can conduct 1 Pendulum Summon of a monster(s) from your hand in addition to your Pendulum Summon. (You can only gain this effect once per turn.),1.0,100.0,100.0,Warrior,LIGHT,
75285069,Moisture Creature,Effect Monster,effect,If you Tribute Summon this monster by Tributing 3 monsters on the field  destroy all Spell and Trap Cards on your opponent's side of the field.,9.0,2800.0,2900.0,Fairy,LIGHT,
27288416,Mokey Mokey,Normal Monster,normal,An outcast angel. Nobody knows what he is thinking at all. Sometimes he gets mad and that is dreadful.,1.0,300.0,100.0,Fairy,LIGHT,
99910751,Mokey Mokey Adrift,Effect Monster,effect,"This card's name becomes ""Mokey Mokey"" and is treated as a Normal Monster while face-up on the field or in the GY. You can discard this card; add 1 ""Mokey Mokey"" card from your Deck to your hand  except ""Mokey Mokey Adrift"".",1.0,300.0,100.0,Fairy,LIGHT,Mokey Mokey
13803864,Mokey Mokey King,Fusion Monster,fusion,"""Mokey Mokey"" + ""Mokey Mokey"" + ""Mokey Mokey"" When this card is removed from the field  you can Special Summon as many ""Mokey Mokey"" as possible from your Graveyard.",6.0,300.0,100.0,Fairy,LIGHT,
58807980,Monoceros,Effect Monster,effect,This card cannot be Normal Summoned or Set. This card can only be Special Summoned by removing from play 1 Spell Card from your hand. When you Synchro Summon using this card and a Beast-Type Tuner monster as the Synchro Material Monsters  you can select 1 Beast-Type Tuner monster used for the Synchro Summon and Special Summon it from the Graveyard.,3.0,1000.0,1000.0,Beast,LIGHT,
45909477,Moon Envoy,Normal Monster,normal,Many have fallen victim to this lunar warrior's crescent pike.,4.0,1100.0,1000.0,Warrior,LIGHT,
97452818,Moon Token,Token,token,"Special Summoned with the effect of ""Arcana Force XVIII - The Moon"".",1.0,0.0,0.0,Fairy,LIGHT,Arcana Force
16366944,Moonlit Papillon,Effect Monster,effect,"When this card is sent from the field to the Graveyard: You can Special Summon 1 Level 4 or lower ""Butterspy"" monster from your Deck.",4.0,1200.0,1600.0,Insect,LIGHT,Butterspy
1872843,"Morpheus, the Dream Mirror White Knight",Effect Monster,effect,"If this card is Special Summoned by the effect of a ""Dream Mirror"" monster: You can activate this effect; this card cannot be destroyed by battle or card effects this turn. During the Main or Battle Phase  if ""Dream Mirror of Terror"" is in a Field Zone (Quick Effect): You can Tribute this card; Special Summon 1 ""Morpheus  the Dream Mirror Black Knight"" from your Deck. You can only use each effect of ""Morpheus  the Dream Mirror White Knight"" once per turn.",8.0,1000.0,2800.0,Warrior,LIGHT,Dream Mirror
28124263,Morphtronic Cameran,Effect Monster,effect,"● While in Attack Position: When this card is destroyed by battle  you can Special Summon 1 Level 4 or lower ""Morphtronic"" monster from your hand or Graveyard  except ""Morphtronic Cameran"". ● While in Defense Position: ""Morphtronic"" monsters on the field cannot be targeted by effects.",2.0,800.0,600.0,Machine,LIGHT,Morphtronic
76865611,Morphtronic Lantron,Tuner Monster,effect,● While in Attack Position: Any effect damage you would take from an opponent's card effect is inflicted to your opponent instead. ● While in Defense Position: When this card is destroyed by battle and sent to the Graveyard  you take no Battle Damage this turn.,1.0,200.0,200.0,Machine,LIGHT,Morphtronic
55119278,Morphtronic Radion,Effect Monster,effect,"● While in Attack Position: ""Morphtronic"" monsters you control gain 800 ATK. ● While in Defense Position: ""Morphtronic"" monsters you control gain 1000 DEF.",4.0,1000.0,900.0,Thunder,LIGHT,Morphtronic
10591919,Morphtronic Scopen,Tuner Monster,effect,"● While in Attack Position: Once per turn  you can Special Summon 1 Level 4 ""Morphtronic"" monster from your hand. Destroy it during the End Phase. ● While in Defense Position: While this card is in face-up Defense Position  it is Level 4.",3.0,800.0,1400.0,Machine,LIGHT,Morphtronic
84592800,Morphtronic Videon,Effect Monster,effect,● While in Attack Position: This card gains 800 ATK for each Equip Card equipped to it.  ● While in Defense Position: This card gains 800 DEF for each Equip Card equipped to it.,4.0,1000.0,1000.0,Machine,LIGHT,Morphtronic
3395226,Mozarta the Melodious Maestra,Effect Monster,effect,Once per turn: You can Special Summon 1 LIGHT Fairy-Type monster from your hand. You cannot Special Summon other monsters the turn you activate this effect  except for LIGHT monsters.,8.0,2600.0,2000.0,Fairy,LIGHT,Melodious
86767655,Ms. Judge,Effect Monster,effect,"If an opponent's card effect activates  before resolving that effect  toss a coin twice  and if the result is 2 Heads  negate that effect. You can only use this effect of ""Ms. Judge"" once per turn.",4.0,1800.0,600.0,Fiend,LIGHT,
35514097,Multi Token,Token,token,"Special Summoned with the effect of ""Lord British Space Fighter"".",4.0,1200.0,1200.0,Machine,LIGHT,
92385016,Munin the Runick Wings,Fusion Monster,fusion,"2 ""Runick"" monsters  If this card is Special Summoned from the Extra Deck: You can discard 1 card; add 1 ""Runick"" Continuous Spell from your Deck to your hand. When your opponent activates a card or effect that targets a ""Runick"" card(s) you control or a Set card(s) you control (Quick Effect): You can banish this card you control; negate the activation  and if you do  destroy that card. Once per turn  during the End Phase: Gain 1000 LP.",3.0,0.0,2000.0,Fairy,LIGHT,Runick
69992868,Muse-A,Normal Monster,normal,A fairy of the arts that is unbeatable on the harp.,3.0,850.0,900.0,Fairy,LIGHT,
56907389,Musician King,Fusion Monster,fusion,"""Witch of the Black Forest"" + ""Lady of Faith""",5.0,1750.0,1500.0,Spellcaster,LIGHT,
13735899,Mysterion the Dragon Crown,Fusion Monster,fusion,"1 Spellcaster monster + 1 Dragon monster  Cannot be used as Fusion Material. This card loses 100 ATK for each of your banished cards. If a monster uses its activated effect to Special Summon itself  or a monster(s) with its same original Type (except during the Damage Step): You can target 1 of those Special Summoned monsters; banish that monster  also banish all monsters from the field with its same original Type. You can only use this effect of ""Mysterion the Dragon Crown"" once per turn.",8.0,3000.0,1500.0,Spellcaster,LIGHT,
14198496,Mystic Piper,Effect Monster,effect,"You can Tribute this card to draw and reveal 1 card. If that card is a Level 1 Monster Card  draw 1 more card. The effect of ""Mystic Piper"" can only be activated once per turn.",1.0,0.0,0.0,Spellcaster,LIGHT,
63515678,Mystical Capture Chain,Normal Monster,normal,A mystical chain that binds enemies  rendering them immobile.,2.0,700.0,700.0,Fairy,LIGHT,
15025844,Mystical Elf,Normal Monster,normal,A delicate elf that lacks offense  but has a terrific defense backed by mystical power.,4.0,800.0,2000.0,Spellcaster,LIGHT,
15613529,Mystical Elf - White Lightning,Effect Monster,effect,"When a monster your opponent controls activates its effect  while you control a Level 5 or higher Normal Monster (Quick Effect): You can Special Summon this card from your hand  and if you do  negate that effect. During your opponent's Battle Phase (Quick Effect): You can target 1 Normal Monster in either GY; Special Summon it to your field  and if you do  all monsters your opponent controls must attack that monster this turn  if able  while you control it. You can only use each effect of ""Mystical Elf - White Lightning"" once per turn.",4.0,800.0,2000.0,Spellcaster,LIGHT,
98745000,Mystical Knight of Jackal,Effect Monster,effect,When this card destroys 1 monster on your opponent's side of the field and sends it to your opponent's Graveyard as a result of battle  you can then return the card to the top of your opponent's Deck.,7.0,2700.0,1200.0,Beast-Warrior,LIGHT,
39552864,Mystical Shine Ball,Normal Monster,normal,A soul of light covered by mystical shine. When you see its beautiful shape  your dream will come true.,2.0,500.0,500.0,Fairy,LIGHT,
80959027,Mythical Beast Bashilisk,Pendulum Effect Monster,effect_pendulum,"[ Pendulum Effect ]  If you have no card in your other Pendulum Zone: You can destroy this card  and if you do  shuffle 1 face-up Spellcaster Pendulum Monster from your Extra Deck into your Main Deck  except ""Mythical Beast Bashilisk""  then draw 1 card. You can only use this effect of ""Mythical Beast Bashilisk"" once per turn. [ Monster Effect ]  Each time a Spell Card is activated  place 1 Spell Counter on this card when that Spell resolves. You can remove 3 Spell Counters from your field; return 1 ""Mythical Beast"" card from your Pendulum Zone or face-up from your Extra Deck to the hand. You can only use this effect of ""Mythical Beast Bashilisk"" once per turn.",4.0,1800.0,500.0,Spellcaster,LIGHT,Mythical Beast
55424270,Mythical Beast Cerberus,Effect Monster,effect,Each time a Spell Card is activated  place 1 Spell Counter on this card when that Spell resolves. Gains 500 ATK for each Spell Counter on it. At the end of the Battle Phase  if this card battled  remove all Spell Counters on it.,4.0,1400.0,1400.0,Spellcaster,LIGHT,
28570310,Mythical Beast Garuda,Pendulum Effect Monster,effect_pendulum,"[ Pendulum Effect ]  If you have no card in your other Pendulum Zone: You can target 1 other Spell/Trap on the field; destroy both it and this card. You can only use this effect of ""Mythical Beast Garuda"" once per turn. [ Monster Effect ]  Each time a Spell Card is activated  place 1 Spell Counter on this card when that Spell resolves. When your opponent Normal or Special Summons a monster(s) (except during the Damage Step): You can remove 3 Spell Counters from your field; Special Summon this card from your hand  then return that opponent's Summoned monster(s) to the hand. You can only use this effect of ""Mythical Beast Garuda"" once per turn.",4.0,1200.0,1600.0,Spellcaster,LIGHT,Mythical Beast
