id,name,type,frameType,description,level,atk,def,race,attribute,archetype
60037599,Drytron Gamma Eltanin,Effect Monster,effect,"Cannot be Normal Summoned/Set. Must be Special Summoned with the effect of a ""Drytron"" card. You can Tribute 1 other ""Drytron"" monster  or 1 Ritual Monster  from your hand or field; Special Summon this card from your hand or GY in Defense Position  then you can Special Summon 1 ""Drytron"" monster with 2000 ATK from your GY  except ""Drytron Gamma Eltanin"". You cannot Special Summon monsters  except monsters that cannot be Normal Summoned/Set  the turn you activate this effect. You can only use this effect of ""Drytron Gamma Eltanin"" once per turn.",1.0,2000.0,0.0,Machine,LIGHT,Drytron
69815951,Drytron Meteonis Draconids,Ritual Effect Monster,ritual,"You can Ritual Summon this card with ""Meteonis Drytron"". Your opponent cannot target this card with monster effects. If the total Levels of monsters used for its Ritual Summon are 2 or less  this card can attack all Special Summoned monsters your opponent controls once each. During your opponent's turn (Quick Effect): You can banish monsters from your GY whose combined ATK equals exactly 2000 or 4000  then target 1 face-up card your opponent controls for every 2000 ATK of the total; send that card(s) to the GY. You can only use this effect of ""Drytron Meteonis Draconids"" once per turn.",12.0,4000.0,4000.0,Machine,LIGHT,Drytron
95209656,Drytron Meteonis Quadrantids,Ritual Effect Monster,ritual,"You can Ritual Summon this card with ""Meteonis Drytron"". Your opponent cannot target this card with Spell/Trap Cards or effects. You can only use each of the following effects of ""Drytron Meteonis Quadrantids"" once per turn. If the total Levels of monsters used for this card's Ritual Summon were 2 or less: You can destroy all Spells and Traps your opponent controls. If this Ritual Summoned card is destroyed: You can Special Summon ""Drytron"" monsters from your GY  except ""Drytron Meteonis Quadrantids""  whose combined ATK equals exactly 4000.",12.0,4000.0,4000.0,Machine,LIGHT,Drytron
1174075,Drytron Mu Beta Fafnir,XYZ Monster,xyz,"2+ Level 1 monsters  When you Ritual Summon  you can detach a material(s) from this card as monster(s) required for the Ritual Summon. You can only use each of the following effects of ""Drytron Mu Beta Fafnir"" once per turn. If this card is Xyz Summoned: You can send 1 ""Drytron"" card from your Deck to the GY. When your opponent activates a Spell/Trap Card  while you control a Machine Ritual Monster (Quick Effect): You can detach 1 material from this card; negate the activation  and if you do  destroy that card.",1.0,2000.0,0.0,Machine,LIGHT,Drytron
96026108,Drytron Zeta Aldhibah,Effect Monster,effect,"Cannot be Normal Summoned/Set. Must be Special Summoned with the effect of a ""Drytron"" card. You can Tribute 1 other ""Drytron"" monster  or 1 Ritual Monster  from your hand or field; Special Summon this card from your hand or GY in Defense Position  then you can add 1 Ritual Spell from your Deck to your hand. You cannot Special Summon monsters  except monsters that cannot be Normal Summoned/Set  the turn you activate this effect. You can only use this effect of ""Drytron Zeta Aldhibah"" once per turn.",1.0,2000.0,0.0,Machine,LIGHT,Drytron
33026283,Dual Avatar - Empowered Kon-Gyo,Fusion Monster,fusion,"""Dual Avatar Fists - Yuhi"" + 2 ""Dual Avatar"" monsters  If this card battles  your opponent cannot activate cards or effects until the end of the Damage Step. If this card attacks  after damage calculation: You can return 1 monster your opponent controls to the hand. When your opponent's Spell/Trap Card or effect is activated that targets this card on the field  while you control 2 or more Fusion Monsters (Quick Effect): You can negate the activation. You can only use this effect of ""Dual Avatar - Empowered Kon-Gyo"" once per turn.",8.0,3000.0,1700.0,Warrior,LIGHT,Dual Avatar
284224,Dual Avatar - Empowered Mitsu-Jaku,Fusion Monster,fusion,"""Dual Avatar Feet - Kokoku"" + 2 ""Dual Avatar"" monsters  The first time each ""Dual Avatar"" Fusion Monster you control would be destroyed by battle each turn  it is not destroyed. Once per turn  during your Main Phase: You can return all Spells and Traps your opponent controls to the hand. When a monster effect is activated on your opponent's field while you control 2 or more Fusion Monsters (Quick Effect): You can destroy that monster. You can only use this effect of ""Dual Avatar - Empowered Mitsu-Jaku"" once per turn.",7.0,2000.0,3000.0,Warrior,LIGHT,Dual Avatar
28798938,Dual Avatar - Manifested A-Un,Fusion Monster,fusion,"2 ""Dual Avatar"" monsters  This card gains the following effect(s)  based on the original names of the materials used for its Fusion Summon. ● ""Dual Avatar - Empowered Kon-Gyo"": The ATK of your battling ""Dual Avatar"" monsters become 3000 during damage calculation only. ● ""Dual Avatar - Empowered Mitsu-Jaku"": Once per opponent's turn (Quick Effect): You can target 1 card on the field; banish it.  If this Fusion Summoned card is destroyed: You can Special Summon 1 ""Dual Avatar Fists - Yuhi"" and 1 ""Dual Avatar Feet - Kokoku"" from your Deck  and if you do  they cannot be destroyed by battle or card effects this turn.",4.0,0.0,0.0,Warrior,LIGHT,Dual Avatar
7631534,Dual Avatar Feet - Armored Un-Gyo,Fusion Monster,fusion,"2 ""Dual Avatar"" monsters  If a ""Dual Avatar"" Fusion Monster(s) you control would be destroyed by card effect  you can destroy 1 ""Dual Avatar"" monster you control instead. During the Main Phase  if you control a ""Dual Avatar"" Fusion Monster that was Fusion Summoned using an Effect Monster as material (Quick Effect): You can target 1 face-up monster Special Summoned from the Extra Deck; negate its effects until the end of this turn. You can only use this effect of ""Dual Avatar Feet - Armored Un-Gyo"" once per turn.",5.0,1700.0,2100.0,Warrior,LIGHT,Dual Avatar
11759079,Dual Avatar Feet - Kokoku,Effect Monster,effect,"If this card is Normal or Special Summoned: You can add 1 ""Dual Avatar"" Trap from your Deck to your hand. During your opponent's turn  if a face-up ""Dual Avatar"" monster(s) you control  except ""Dual Avatar Feet - Kokoku""  is destroyed by battle or card effect: You can Special Summon this card from your hand  then you can apply this effect.  ● Destroy 1 ""Dual Avatar"" monster you control  and if you do  Special Summon 1 ""Dual Avatar"" Fusion Monster from your Extra Deck.  You can only use each effect of ""Dual Avatar Feet - Kokoku"" once per turn.",3.0,800.0,2000.0,Warrior,LIGHT,Dual Avatar
60237530,Dual Avatar Fists - Armored Ah-Gyo,Fusion Monster,fusion,"2 ""Dual Avatar"" monsters  If this card is Special Summoned: You can target 1 Attack Position monster your opponent controls; destroy it  also this card cannot attack directly for the rest of this turn. You can only use this effect of ""Dual Avatar Fists - Armored Ah-Gyo"" once per turn. While you control a ""Dual Avatar"" Fusion Monster that was Fusion Summoned using an Effect Monster as material  all ""Dual Avatar"" Fusion Monsters you control gain 300 ATK/DEF.",6.0,2100.0,1500.0,Warrior,LIGHT,Dual Avatar
85360035,Dual Avatar Fists - Yuhi,Effect Monster,effect,"You can target 1 ""Dual Avatar"" monster you control; destroy it  and if you do  add 1 ""Dual Avatar"" Spell from your Deck to your hand. If a face-up ""Dual Avatar"" Fusion Monster(s) you control  that was Fusion Summoned using an Effect Monster as material  is destroyed by battle or an opponent's card effect  while this card is in your GY: You can add this card to your hand. You can only use each effect of ""Dual Avatar Fists - Yuhi"" once per turn.",4.0,1800.0,1000.0,Warrior,LIGHT,Dual Avatar
14506878,DUCKER Mobile Cannon,Flip Effect Monster,effect,FLIP: Target 1 Level 4 monster in your Graveyard; add that target to your hand.,3.0,500.0,500.0,Machine,LIGHT,
12493482,Dunames Dark Witch,Normal Monster,normal,Even when all odds are against this brave fairy  she will press onwards in battle and never retreat.,4.0,1800.0,1050.0,Fairy,LIGHT,
20137754,Duza the Meteor Cubic Vessel,Effect Monster,effect,"If this card is Normal or Special Summoned: You can send 1 ""Cubic"" card from your Deck to the Graveyard. Once per turn  during either player's turn  if a monster was sent to your Graveyard this turn while this card was face-up on the field: You can make this card gain 200 ATK for each monster with a different name in your Graveyard  until the end of this turn.",4.0,1600.0,1600.0,Machine,LIGHT,Cubic
67310848,Dwarf Star Dragon Planeter,Effect Monster,effect,Once per turn  during the End Phase  if this card was Normal Summoned this turn: You can add 1 Level 7 LIGHT or DARK monster from your Deck to your hand.,4.0,1700.0,1200.0,Dragon,LIGHT,
51858306,Eclipse Wyvern,Effect Monster,effect,If this card is sent to the Graveyard: Banish 1 Level 7 or higher LIGHT or DARK Dragon-Type monster from your Deck. If this card is banished from your Graveyard: You can add the monster banished by this card's effect to your hand.,4.0,1600.0,1000.0,Dragon,LIGHT,
95457011,Edea the Heavenly Squire,Effect Monster,effect,"If this card is Normal or Special Summoned: You can Special Summon 1 monster with 800 ATK and 1000 DEF from your Deck in Defense Position  except ""Edea the Heavenly Squire""  also you cannot Special Summon monsters from the Extra Deck for the rest of this turn. If this card is sent to the Graveyard: You can target 1 of your banished ""Monarch"" Spell/Trap Cards; add it to your hand. You can only use each effect of ""Edea the Heavenly Squire"" once per turn.",1.0,800.0,1000.0,Warrior,LIGHT,Monarch
97268402,Effect Veiler,Tuner Monster,effect,During your opponent's Main Phase (Quick Effect): You can send this card from your hand to the GY  then target 1 Effect Monster your opponent controls; negate the effects of that face-up monster your opponent controls  until the end of this turn.,1.0,0.0,0.0,Spellcaster,LIGHT,
44178886,"Ehren, Lightsworn Monk",Effect Monster,effect,If this card attacks a Defense Position monster  before damage calculation: Shuffle that monster into the Deck. Once per turn  during your End Phase: Send the top 3 cards of your Deck to the Graveyard.,4.0,1600.0,1000.0,Warrior,LIGHT,Lightsworn
96570609,Ehther the Heavenly Monarch,Effect Monster,effect,"You can Tribute Summon this card by Tributing 1 Tribute Summoned monster. If this card is Tribute Summoned: You can send 2 ""Monarch"" Spell/Trap Cards with different names from your hand and/or Deck to the Graveyard  and if you do  Special Summon 1 monster with 2400 or more ATK and 1000 DEF from your Deck  but return it to the hand during the End Phase. During your opponent's Main Phase  if this card is in your hand: You can banish 1 ""Monarch"" Spell/Trap Card from your Graveyard; immediately after this effect resolves  Tribute Summon this card (this is a Quick Effect).",8.0,2800.0,1000.0,Fairy,LIGHT,Monarch
20366274,El Shaddoll Construct,Fusion Monster,fusion,"1 ""Shaddoll"" monster + 1 LIGHT monster  Must first be Fusion Summoned. If this card is Special Summoned: You can send 1 ""Shaddoll"" card from your Deck to the GY. At the start of the Damage Step  if this card battles a Special Summoned monster: Destroy that monster. If this card is sent to the GY: You can target 1 ""Shaddoll"" Spell/Trap in your GY; add it to your hand.",8.0,2800.0,2500.0,Fairy,LIGHT,Shaddoll
6367785,Eldeen,Normal Monster,normal,The cane of this monster is the source of many powerful spells.,3.0,950.0,1000.0,Spellcaster,LIGHT,
80532587,Elder Entity N'tss,Fusion Monster,fusion,"1 Synchro Monster + 1 Xyz Monster Must be Special Summoned (from your Extra Deck) by sending the above cards you control to the GY. (You do not use ""Polymerization"".) Once per turn: You can Special Summon 1 Level 4 monster from your hand. If this card is sent to the GY: You can target 1 card on the field; destroy it. You can only Special Summon ""Elder Entity N'tss(s)"" once per turn.",4.0,2500.0,1200.0,Fairy,LIGHT,
95440946,Eldlich the Golden Lord,Effect Monster,effect,"You can send this card and 1 Spell/Trap from your hand to the GY  then target 1 card on the field; send it to the GY. If this card is in your GY: You can send 1 Spell/Trap you control to the GY; add this card to your hand  then you can Special Summon 1 Zombie monster from your hand  and if you do  until the end of your opponent's turn  it gains 1000 ATK/DEF and cannot be destroyed by card effects. You can only use each effect of ""Eldlich the Golden Lord"" once per turn.",10.0,2500.0,2800.0,Zombie,LIGHT,Eldlich
74889525,Eldlich the Mad Golden Lord,Fusion Monster,fusion,"1 ""Eldlich"" monster + 1 Level 5 or higher Zombie monster  This card's name becomes ""Eldlich the Golden Lord"" while on the field. Cannot be destroyed by battle or card effects. You can Tribute 1 Zombie monster  then target 1 face-up monster your opponent controls; take control of it  but it cannot attack or activate its effects this turn. You can only use this effect of ""Eldlich the Mad Golden Lord"" once per turn.",10.0,3800.0,3500.0,Zombie,LIGHT,Eldlich
11324436,Electric Snake,Effect Monster,effect,When this card is discarded from your hand to the Graveyard by an effect of a card controlled by your opponent  draw 2 cards from your Deck.,3.0,800.0,900.0,Thunder,LIGHT,
24725825,Electric Virus,Effect Monster,effect,You can discard this card to the Graveyard  then target 1 Machine or Dragon-Type monster your opponent controls; take control of that target until the End Phase.,3.0,1000.0,1000.0,Thunder,LIGHT,
7914843,Electromagnetic Bagworm,Flip Effect Monster,effect,FLIP: Target 1 Machine-Type monster your opponent controls; take control of that target until your next End Phase. If this card is destroyed by battle: The monster that destroyed it loses 500 ATK and DEF.,3.0,200.0,1400.0,Insect,LIGHT,
34710660,Electromagnetic Turtle,Effect Monster,effect,"During your opponent's Battle Phase (Quick Effect): You can banish this card from your GY; end the Battle Phase. You can only use this effect of ""Electromagnetic Turtle"" once per Duel.",4.0,0.0,1800.0,Machine,LIGHT,
79514956,Elegy the Melodious Diva,Effect Monster,effect,"Special Summoned ""Melodious"" monsters you control cannot be destroyed by card effects. If this card was Special Summoned  all Fairy-Type monsters you control gain 300 ATK.",5.0,2000.0,1200.0,Fairy,LIGHT,Melodious
30314994,Element Dragon,Effect Monster,effect,This monster gets the following effect(s) while there is a monster(s) with the following Attribute(s) on the field: ● FIRE: This card gains 500 ATK. ● WIND: If this card destroyed your opponent's monster by battle  it can attack once again in a row.,4.0,1500.0,1200.0,Dragon,LIGHT,
65260293,Element Magician,Effect Monster,effect,This monster gets the following effect(s) while there is a monster(s) with the following Attribute(s) on the field: ● WATER: Control of this card cannot switch. ● WIND: If this card destroyed your opponent's monster by battle  it can attack once again in a row.,4.0,1500.0,1200.0,Spellcaster,LIGHT,
97623219,Element Valkyrie,Effect Monster,effect,"(This card is not treated as a ""Valkyrie"" card.)  This monster gets the following effect(s) while there is a monster(s) with the following Attribute(s) on the field:  ● FIRE: This card gains 500 ATK.  ● WATER: Control of this card cannot switch.",4.0,1500.0,1200.0,Fairy,LIGHT,
32965616,Elemental Grace Doriado,Effect Monster,effect,Cannot be Normal Summoned/Set. Must be Special Summoned (from your hand) by having 6 or more monsters with different Attributes in the GYs. Gains ATK/DEF equal to the number of different Attributes in the GYs x 500. When your opponent would Special Summon a monster(s) (Quick Effect): You can banish 3 monsters from your GY; negate the Summon  and if you do  destroy that monster(s).,9.0,0.0,0.0,Spellcaster,LIGHT,Doriado
64655485,Elemental HERO Brave Neos,Fusion Monster,fusion,"""Elemental HERO Neos"" + 1 Level 4 or lower Effect Monster  Must be Fusion Summoned. Gains 100 ATK for each ""Neo-Spacian"" and ""HERO"" monster in your GY. When this card destroys an opponent's monster by battle: You can add 1 Spell/Trap from your Deck to your hand that specifically lists the card ""Elemental HERO Neos"" in its text.",7.0,2500.0,2000.0,Warrior,LIGHT,Elemental HERO
80908502,Elemental HERO Captain Gold,Effect Monster,effect,"You can discard this card to the Graveyard; add 1 ""Skyscraper"" from your Deck to your hand. If ""Skyscraper"" is not face-up on the field  destroy this card.",4.0,2100.0,800.0,Warrior,LIGHT,Elemental HERO
90050480,Elemental HERO Cosmo Neos,Fusion Monster,fusion,"""Elemental HERO Neos"" + 3 ""Neo-Spacian"" monsters with different Attributes  Must first be Special Summoned (from your Extra Deck) by shuffling the above cards you control into the Deck. (You do not use ""Polymerization"".) If this card is Special Summoned from the Extra Deck: You can activate this effect; for the rest of this turn  your opponent cannot activate cards  also cards your opponent controls cannot activate their effects. Your opponent cannot activate cards or effects in response to this effect's activation. Once per turn  during the End Phase: Shuffle this card into the Extra Deck  and if you do  destroy all cards your opponent controls.",11.0,3500.0,3000.0,Warrior,LIGHT,Elemental HERO
31111109,Elemental HERO Divine Neos,Fusion Monster,fusion,"Must be Fusion Summoned using any 5 ""Neos""  ""Neo Space""  ""Neo-Spacian""  or ""HERO"" monsters  including at least 1 ""Neos"" or ""Neo Space"" monster  1 ""Neo-Spacian"" monster  and 1 ""HERO"" monster  and cannot be Special Summoned by other ways. Once per turn: You can banish 1 ""Neos""  ""Neo Space""  ""Neo-Spacian""  or ""HERO"" monster from your Graveyard; this card gains 500 ATK  and until the End Phase it also gains the banished monster's effects.",12.0,2500.0,2500.0,Warrior,LIGHT,Elemental HERO
29343734,Elemental HERO Electrum,Fusion Monster,fusion,"""Elemental HERO Avian"" + ""Elemental HERO Burstinatrix"" + ""Elemental HERO Clayman"" + ""Elemental HERO Bubbleman"" Must be Fusion Summoned and cannot be Special Summoned by other ways. While face-up on the field  this card is also WIND  WATER  FIRE  and EARTH-Attribute. When this card is Fusion Summoned: Shuffle all banished cards into the Deck(s). This card gains 300 ATK for each monster your opponent controls that shares an Attribute with this card.",10.0,2900.0,2600.0,Warrior,LIGHT,Elemental HERO
69572169,Elemental HERO Flash,Effect Monster,effect,"When this card is destroyed by battle and sent to the Graveyard: You can banish this card and 3 ""Elemental HERO"" Monster Cards with different names from your Graveyard to target 1 Normal Spell Card in your Graveyard; add that target to your hand.",4.0,1100.0,1600.0,Warrior,LIGHT,Elemental HERO
85507811,Elemental HERO Glow Neos,Fusion Monster,fusion,"""Elemental HERO Neos"" + ""Neo-Spacian Glow Moss"" Must first be Special Summoned (from your Extra Deck) by shuffling the above cards you control into the Deck. (You do not use ""Polymerization"".) During the End Phase: Shuffle this card into the Extra Deck. Once per turn  during your Main Phase 1: You can target 1 face-up card your opponent controls; destroy that target  then apply the effect based on its type. ● Monster: This card cannot attack this turn. ● Spell: This card can attack your opponent directly this turn. ● Trap: Change this card to Defense Position.",7.0,2500.0,2000.0,Warrior,LIGHT,Elemental HERO
36841733,Elemental HERO Grandmerge,Fusion Monster,fusion,"2 ""HERO"" Normal Monsters  Must be Fusion Summoned. Gains ATK/DEF equal to the combined original Levels of the materials used for its Fusion Summon x 300. When this card destroys an opponent's monster by battle: You can Tribute this card; Special Summon 1 ""Elemental HERO"" Fusion Monster from your Extra Deck  ignoring its Summoning conditions  but it cannot attack monsters with an equal or lower Level than it.",6.0,0.0,0.0,Warrior,LIGHT,Elemental HERO
14124483,Elemental HERO Honest Neos,Effect Monster,effect,"(Quick Effect): You can discard this card  then target 1 ""HERO"" monster on the field; it gains 2500 ATK until the end of this turn. (Quick Effect): You can discard 1 ""HERO"" monster; this card gains ATK equal to the discarded monster's ATK until the end of this turn. You can only use each effect of ""Elemental HERO Honest Neos"" once per turn.",7.0,2500.0,2000.0,Warrior,LIGHT,Elemental HERO
89943723,Elemental HERO Neos,Normal Monster,normal,''A new Elemental HERO has arrived from Neo-Space! When he initiates a Contact Fusion with a Neo-Spacian his unknown powers are unleashed.'',7.0,2500.0,2000.0,Warrior,LIGHT,Elemental HERO
69884162,Elemental HERO Neos Alius,Gemini Monster,effect,"This card is treated as a Normal Monster while face-up on the field or in the GY. While this card is a Normal Monster on the field  you can Normal Summon it to have it become an Effect Monster with this effect.  ● This card's name becomes ""Elemental HERO Neos"" while on the field.",4.0,1900.0,1300.0,Warrior,LIGHT,Elemental HERO
90307498,Elemental HERO Neos Kluger,Fusion Monster,fusion,"""Elemental HERO Neos"" + ""Yubel""  Must be Fusion Summoned. Before damage calculation  if this card battles an opponent's monster: You can inflict damage to your opponent equal to that opponent's monster's ATK. If this face-up card is destroyed by battle  or leaves the field because of an opponent's card effect while its owner controls it: You can Special Summon 1 ""Neos Wiseman"" from your hand or Deck  ignoring its Summoning conditions. You can only use this effect of ""Elemental HERO Neos Kluger"" once per turn.",9.0,3000.0,2500.0,Spellcaster,LIGHT,Elemental HERO
72926163,Elemental HERO Neos Knight,Fusion Monster,fusion,"""Elemental HERO Neos"" + 1 Warrior monster  Must be Fusion Summoned. Gains ATK equal to half the original ATK of the Warrior Fusion Material used for its Fusion Summon  except ""Elemental HERO Neos"". Can make a second attack during each Battle Phase. Your opponent takes no battle damage from attacks involving this card.",7.0,2500.0,1000.0,Warrior,LIGHT,Elemental HERO
89312388,Elemental HERO Prisma,Effect Monster,effect,Once per turn: You can reveal 1 Fusion Monster from your Extra Deck  then send 1 of the Fusion Materials whose name is specifically listed on that card from your Deck to the Graveyard; this card's name becomes the sent monster's until the End Phase.,4.0,1700.0,1100.0,Warrior,LIGHT,Elemental HERO
25366484,Elemental HERO Shining Flare Wingman,Fusion Monster,fusion,"""Elemental HERO Flame Wingman"" + ""Elemental HERO Sparkman"" Must be Fusion Summoned and cannot be Special Summoned by other ways. This card gains 300 ATK for each ""Elemental HERO"" card in your Graveyard. When this card destroys a monster by battle and sends it to the Graveyard: Inflict damage to your opponent equal to the ATK of the destroyed monster in the Graveyard.",8.0,2500.0,2100.0,Warrior,LIGHT,Elemental HERO
56733747,Elemental HERO Shining Neos Wingman,Fusion Monster,fusion,"""Elemental HERO Neos"" + 1 ""Wingman"" Fusion Monster  Must be Fusion Summoned. Gains 300 ATK for each monster in your GY  also cannot be destroyed by card effects. If this card is Special Summoned: You can destroy cards your opponent controls up to the number of different Attributes among the monsters on the field. You can only use this effect of ""Elemental HERO Shining Neos Wingman"" once per turn. If this card destroys a monster by battle: Inflict damage to your opponent equal to that monster's original ATK.",8.0,3100.0,2500.0,Warrior,LIGHT,Elemental HERO
20721928,Elemental HERO Sparkman,Normal Monster,normal,An Elemental HERO and a warrior of light who proficiently wields many kinds of armaments. His Static Shockwave cuts off the path of villainy.,4.0,1600.0,1400.0,Warrior,LIGHT,Elemental HERO
13256226,Elemental HERO Spirit of Neos,Effect Monster,effect,"When an opponent's monster declares an attack: You can Special Summon this card from your hand in Defense Position  and if you do  it cannot be destroyed by battle. If this card is Special Summoned: You can add from your Deck to your hand 1 ""Polymerization"" or 1 Spell/Trap that mentions an ""Elemental HERO"" monster's card name. During your Main Phase: You can shuffle this card into the Deck  and if you do  Special Summon 1 ""Elemental HERO"" Normal Monster from your Deck. You can only use each effect of ""Elemental HERO Spirit of Neos"" once per turn.",7.0,2500.0,2000.0,Warrior,LIGHT,Elemental HERO
22908820,Elemental HERO Sunrise,Fusion Monster,fusion,"2 ""HERO"" monsters with different Attributes  Must be Fusion Summoned. Monsters you control gain 200 ATK for each different Attribute you control. You can only use each of the following effects of ""Elemental HERO Sunrise"" once per turn.  ● If this card is Special Summoned: You can add 1 ""Miracle Fusion"" from your Deck to your hand.  ● When an attack is declared involving another ""HERO"" monster you control: You can target 1 card on the field; destroy it.",7.0,2500.0,1200.0,Warrior,LIGHT,Elemental HERO
22061412,Elemental HERO The Shining,Fusion Monster,fusion,"1 ""Elemental HERO"" monster + 1 LIGHT monster Must be Fusion Summoned and cannot be Special Summoned by other ways. This card gains 300 ATK for each of your banished ""Elemental HERO"" monsters. When this card is sent from the field to the Graveyard: You can target up to 2 of your banished ""Elemental HERO"" monsters; add those targets to your hand.",8.0,2600.0,2100.0,Warrior,LIGHT,Elemental HERO
