id,name,type,frameType,description,level,atk,def,race,attribute,archetype
9000988,Performapal Coin Dragon,Pendulum Effect Monster,effect_pendulum,[ Pendulum Effect ]  Once per turn: You can target 1 Dragon-Type monster you control that was Special Summoned from the Extra Deck; this turn  if that monster you control battles an opponent's monster  banish that opponent's monster after damage calculation (even if this card leaves the field). [ Monster Effect ]  Other Dragon-Type monsters you control gain 500 ATK  also they cannot be destroyed by card effects.,4.0,1700.0,1000.0,Dragon,WATER,Performapal
53724621,Performapal Guitartle,Pendulum Effect Monster,effect_pendulum,"[ Pendulum Effect ]  If a ""Performapal"" card is activated in your other Pendulum Zone: You can draw 1 card. You can only use this effect of ""Performapal Guitartle"" once per turn. [ Monster Effect ]  Once per turn: You can target 1 card in your Pendulum Zone; increase its Pendulum Scale by 2 until the end of this turn.",1.0,300.0,400.0,Aqua,WATER,Performapal
16617334,Performapal Rain Goat,Effect Monster,effect,"When a card or effect is activated that would inflict damage to you (Quick Effect): You can discard this card; make that effect damage to you 0. During the Main Phase (Quick Effect): You can discard this card  then target 1 ""Performapal"" or ""Odd-Eyes"" card you control; this turn  it cannot be destroyed by battle or card effects.",1.0,0.0,0.0,Beast,WATER,Odd-Eyes
33833230,Performapal Seal Eel,Pendulum Effect Monster,effect_pendulum,[ Pendulum Effect ]  Once per turn: You can target 1 face-up monster your opponent controls; that face-up monster has its effects negated until the end of this turn (even if this card leaves the field). [ Monster Effect ]  When this card is Normal or Special Summoned: You can target 1 Set Spell/Trap Card your opponent controls; that Set card cannot be activated this turn. Neither player can activate cards or effects in response to this effect's activation.,1.0,100.0,100.0,Fish,WATER,Performapal
23377694,Performapal Sellshell Crab,Pendulum Effect Monster,effect_pendulum,"[ Pendulum Effect ]  Once per turn  when a ""Performapal"" monster you control is destroyed by battle: You can target 1 ""Performapal"" or ""Odd-Eyes"" card in your Pendulum Zone; Special Summon it. [ Monster Effect ]  Once per turn: You can target 1 Pendulum Monster you control; it gains 300 ATK for each ""Performapal"" monster you currently control  until the end of this turn.",5.0,500.0,2500.0,Aqua,WATER,Performapal
42562690,Performapal Skeeter Skimmer,Effect Monster,effect,When this face-up Attack Position card is targeted for an attack: You can change this card to face-up Defense Position  and if you do  negate that attack.,4.0,500.0,1600.0,Insect,WATER,Performapal
52963531,Performapal Splashmammoth,Pendulum Effect Monster,effect_pendulum,"[ Pendulum Effect ]  Once per turn  when a Fusion Monster(s) is Special Summoned to your side of the field (except during the Damage Step): You can Special Summon 1 face-up ""Odd-Eyes"" Pendulum Monster from your Extra Deck. [ Monster Effect ]  During your Main Phase: You can Fusion Summon 1 Dragon-Type Fusion Monster from your Extra Deck  using monsters you control as Fusion Materials. You can only use this effect of ""Performapal Splashmammoth"" once per Duel.",6.0,1900.0,2300.0,Beast,WATER,Performapal
65195959,Performapal Stamp Turtle,Effect Monster,effect,Once per turn: You can target up to 2 face-up monsters on the field; increase their Levels by 1.,4.0,100.0,1800.0,Aqua,WATER,Performapal
15452043,Performapal Sword Fish,Effect Monster,effect,If this card is Normal or Special Summoned: All monsters your opponent currently controls lose 600 ATK and DEF. If you Special Summon a monster(s) while you control this card: All monsters your opponent currently controls lose 600 ATK and DEF.,2.0,600.0,600.0,Fish,WATER,Performapal
4239451,Performapal Turn Toad,Pendulum Effect Monster,effect_pendulum,[ Pendulum Effect ]  Once per turn: You can target 1 face-up monster on the field; switch its current ATK and DEF until the end of this turn. [ Monster Effect ]  Once per turn  during your Battle Phase (except during the Damage Step): You can target 1 monster you control; change its battle position  and if you do  switch its current ATK and DEF until the end of this turn.,2.0,0.0,800.0,Aqua,WATER,Performapal
56649609,Phantasm Spiral Dragon,Normal Monster,normal,A ferocious serpent that was being hunted by Atlanteans. Battle-weary and ragged  it came upon an ancient light  and gained new strength for its battle. With its increased power  it launched an invasion of enemy territory with a renewed assault.,8.0,2900.0,2900.0,Wyrm,WATER,Atlantean
2819436,Phantasm Spiral Token,Token,token,"Summoned by the effect of ""Pacifis  the Phantasm City"".",8.0,2000.0,2000.0,Wyrm,WATER,Phantasm Spiral
43191636,Phantom Dragonray Bronto,Gemini Monster,effect,This card is treated as a Normal Monster while face-up on the field or in the Graveyard. While this card is face-up on the field  you can Normal Summon it to have it be treated as an Effect Monster with this effect: ● The original ATK of this card becomes 2300. If this card attacks  it is changed to Defense Position at the end of the Battle Phase. This card's battle position cannot be changed until the end of your next turn  except with a card effect.,4.0,1500.0,1000.0,Fish,WATER,
69846323,Piercing Moray,Effect Monster,effect,Once per turn: You can Tribute 1 Fish  Sea Serpent  or Aqua-Type monster; this card gains 600 ATK. If this card attacks a Defense Position monster  inflict piercing Battle Damage to your opponent.,4.0,1500.0,500.0,Fish,WATER,
20700531,Pilgrim of the Ice Barrier,Effect Monster,effect,This card cannot be destroyed by battle with a monster with 1900 or more ATK.,4.0,1500.0,1000.0,Warrior,WATER,Ice Barrier
50823978,Piranha Army,Effect Monster,effect,The Battle Damage this card inflicts by attacking your opponent's Life Points directly is doubled.,2.0,800.0,200.0,Fish,WATER,
83682209,Piwraithe the Ghost Pirate,Effect Monster,effect,"If a face-up WATER monster(s) you control  except ""Piwraithe the Ghost Pirate""  is destroyed by battle or card effect  while this card is in your GY: You can Special Summon this card (but banish it when it leaves the field)  and if you do  it gains 100 ATK for each WATER monster in your GY  until the end of the next turn. You can only use this effect of ""Piwraithe the Ghost Pirate"" once per turn.",4.0,1500.0,500.0,Aqua,WATER,
56840658,Poison Draw Frog,Effect Monster,effect,When this face-up card on the field is sent to the Graveyard (unless it was attacked while face-down and destroyed by battle)  you can draw 1 card.,2.0,100.0,100.0,Aqua,WATER,Frog
80476891,Poly-Chemicritter Hydragon,Gemini Monster,effect,This card is treated as a Normal Monster while face-up on the field or in the Graveyard. While this card is a Normal Monster on the field  you can Normal Summon it to have it become an Effect Monster with these effects. ● When another Gemini monster is Normal Summoned: You can make that monster gain 500 ATK and DEF. ● If a Gemini monster(s) you control would be destroyed by a card effect  you can destroy 1 other card you control instead.,8.0,200.0,2800.0,Dragon,WATER,Chemicritter
47826112,"Poseidra, the Atlantean Dragon",Effect Monster,effect,You can Tribute 3 Level 3 or lower WATER monsters; Special Summon this card from your hand or Graveyard. When you do: Return all Spell and Trap Cards on the field to the hand  and if you do  if 3 or more cards are returned to the hand by this effect  all monsters your opponent currently controls lose 300 ATK for each.,7.0,2800.0,1600.0,Sea Serpent,WATER,Atlantean
50621530,Powered Tuner,Effect Monster,effect,This card gains 500 ATK for each face-up Tuner monster on the field.,4.0,1400.0,1000.0,Dragon,WATER,
55725117,Prank-Kids Dropsies,Effect Monster,effect,"If this card is sent to the GY as material for the Fusion or Link Summon of a ""Prank-Kids"" monster: You can gain 1000 LP  then you can Special Summon 1 ""Prank-Kids"" monster from your hand or Deck in Defense Position  except ""Prank-Kids Dropsies"". You can only use this effect of ""Prank-Kids Dropsies"" once per turn.",2.0,1000.0,1000.0,Aqua,WATER,Prank-Kids
70875686,Prank-Kids Rip-Roarin-Roaster,Link Monster,link,"2+ ""Prank-Kids"" monsters  Must be Link Summoned. (Quick Effect): You can Tribute this card; destroy all Spells and Traps your opponent controls. If this card in your possession is sent to your GY by your opponent's card: You can target 1 card in your GY  except a Link Monster; add it to your hand. You can only use this effect of ""Prank-Kids Rip-Roarin-Roaster"" once per turn.",,3000.0,,Aqua,WATER,Prank-Kids
44509529,Prank-Kids Weather Washer,Fusion Monster,fusion,"2 ""Prank-Kids"" monsters  If your ""Prank-Kids"" monster attacks  your opponent cannot activate cards or effects until the end of the Damage Step. During your opponent's turn (Quick Effect): You can Tribute this card  then target 2 ""Prank-Kids"" non-Fusion Monsters with different names in your GY; Special Summon them. They cannot be destroyed by battle this turn. You can only use this effect of ""Prank-Kids Weather Washer"" once per turn.",5.0,2000.0,0.0,Aqua,WATER,Prank-Kids
67503139,Prediction Princess Crystaldine,Flip Effect Monster,effect,FLIP: You can add 1 Ritual Monster from your Deck or Graveyard to your hand.,5.0,1400.0,2200.0,Fairy,WATER,Prediction Princess
8129306,Primula the Rikka Fairy,Effect Monster,effect,"If a monster you control is Tributed (except during the Damage Step): You can Special Summon this card from your hand in Defense Position. You can target up to 2 Plant monsters you control; increase their Level(s) by 2 until the end of this turn. You can only use each effect of ""Primula the Rikka Fairy"" once per turn.",4.0,800.0,1800.0,Plant,WATER,Rikka
50088247,Prior of the Ice Barrier,Effect Monster,effect,"If you control a face-up ""Ice Barrier"" monster  you can Special Summon this card (from your hand). You cannot Special Summon any Level 5 or higher monsters the turn you use this effect. You can Tribute this card to target 1 ""Ice Barrier"" monster in your Graveyard  except ""Prior of the Ice Barrier""; Special Summon that target.",2.0,1000.0,400.0,Aqua,WATER,Ice Barrier
101203016,"Psiics, Moonlight of the Ghoti",Effect Monster,effect,"If this card is Normal or Special Summoned: You can add 1 Fish monster from your Deck to your hand  except ""Psiics  Moonlight of the Ghoti""  then banish 1 Fish monster from your hand or face-up field. If this card is banished: You can banish 1 Fish monster from your hand  face-up field  or GY  except ""Psiics  Moonlight of the Ghoti""; Special Summon this card. You can only use each effect of ""Psiics  Moonlight of the Ghoti"" once per turn.",6.0,2400.0,0.0,Fish,WATER,Ghoti
7892180,Psychic Kappa,Normal Monster,normal,An amphibian with a myriad of powers to shield it from enemy attacks.,2.0,400.0,1000.0,Aqua,WATER,
76442347,Puny Penguin,Effect Monster,effect,"When this card is sent from the field to the Graveyard after being flipped face-up: Target 1 ""Penguin"" monster in your Graveyard  except ""Puny Penguin""; Special Summon that target in face-up Attack Position or face-down Defense Position.",1.0,400.0,200.0,Aqua,WATER,Penguin
85101097,Putrid Pudding Body Buddies,Effect Monster,effect,Cannot be used as a Fusion  Synchro  or Xyz Material for a Summon. While this card is face-up on the field  it cannot be Tributed. During your End Phase: You can target 1 card in your Pendulum Zone; destroy it  and if you do  give control of this card to your opponent. During each of your Standby Phases: Take 300 damage.,1.0,300.0,300.0,Fiend,WATER,
73778008,Rage of the Deep Sea,Effect Monster,effect,This card gains 500 ATK and DEF for each Fish  Sea Serpent  or Aqua-Type monster in your Graveyard.,5.0,0.0,0.0,Fish,WATER,
56524813,Raging Eria,Effect Monster,effect,"Once per turn  you can Tribute 1 WATER monster (except this card) to Special Summon 1 WATER monster from your hand. The monster Special Summoned by this effect is destroyed if ""Raging Eria"" is removed from your side of the field.",4.0,800.0,1500.0,Spellcaster,WATER,
29402771,Rainbow Marine Mermaid,Normal Monster,normal,A reticent mermaid who appears only on very rare occasions. She emerges only when a large rainbow arches across the sky.,5.0,1550.0,1700.0,Fish,WATER,
80516007,Rare Fish,Fusion Monster,fusion,"""Fusionist"" + ""Enchanting Mermaid""",4.0,1500.0,1200.0,Fish,WATER,
87188910,Ravenous Crocodragon Archethys,Synchro Monster,synchro,"1 Tuner + 1+ non-Tuner monsters  Gains 500 ATK/DEF for each card in your hand. You can only use each of the following effects of ""Ravenous Crocodragon Archethys"" once per turn.  ● If this card is Synchro Summoned: You can draw cards equal to the number of non-Tuners used for its Synchro Summon.  ● (Quick Effect): You can discard 2 cards  then target 1 card on the field; destroy it.",9.0,1000.0,1000.0,Fish,WATER,
79387392,Reactor Slime,Effect Monster,effect,"During your Main Phase: You can activate this effect; Special Summon 2 ""Slime Tokens"" (Aqua/WATER/Level 1/ATK 500/DEF 500)  also you cannot Normal or Special Summon monsters for the rest of this turn  except Divine-Beast monsters. During the Battle Phase (Quick Effect): You can Tribute this card; Set 1 ""Metal Reflect Slime"" from your hand  Deck  or GY. It can be activated this turn. You can only use each effect of ""Reactor Slime"" once per turn.",4.0,500.0,500.0,Aqua,WATER,Egyptian God
65570596,Red Archery Girl,Normal Monster,normal,A mermaid archer that hides in a protective shell  waiting for the right moment to strike.,4.0,1400.0,1500.0,Aqua,WATER,
68769900,"Redbeard, the Plunder Patroll Matey",Effect Monster,effect,"During your opponent's turn (Quick Effect): You can Special Summon 1 ""Plunder Patroll"" monster from your Extra Deck with the same Attribute as a monster your opponent controls or is in their GY  and if you do  equip this card you control to it. If this card is sent from the hand or Monster Zone to the GY: You can target 1 ""Plunder Patroll"" monster you control  except ""Redbeard  the Plunder Patroll Matey""; equip this card to it. You can only use each effect of ""Redbeard  the Plunder Patroll Matey"" once per turn.",4.0,1000.0,1000.0,Fiend,WATER,Plunder Patroll
30276969,Reese the Ice Mistress,Tuner Monster,effect,This card cannot be destroyed by battle with a Level 4 or higher monster.,2.0,800.0,800.0,Sea Serpent,WATER,
43002864,Reptilianne Gardna,Effect Monster,effect,"When this card you control is destroyed and sent to the Graveyard  add 1 ""Reptilianne"" monster from your Deck to your hand.",4.0,0.0,2000.0,Reptile,WATER,Reptilianne
18319762,Revealer of the Ice Barrier,Effect Monster,effect,"While you control another ""Ice Barrier"" monster  your opponent cannot Tribute Summon. You can only use each of the following effects of ""Revealer of the Ice Barrier"" once per turn. You can discard 1 card; Special Summon 1 ""Ice Barrier"" Tuner from your Deck  also you cannot Special Summon monsters for the rest of this turn  except WATER monsters. If you would discard  or send a card(s) from your hand to the GY  to activate an ""Ice Barrier"" monster's effect  you can banish this card from your GY instead of 1 of those cards.",4.0,1700.0,1000.0,Spellcaster,WATER,Ice Barrier
31709826,Revival Jam,Effect Monster,effect,When this card is destroyed by battle and sent to the Graveyard: You can pay 1000 Life Points; Special Summon it in face-up Defense Position during your next turn's Standby Phase.,4.0,1500.0,500.0,Aqua,WATER,Slime
11845050,Right-Hand Shark,Effect Monster,effect,"When this card is Normal Summoned: You can add 1 ""Left-Hand Shark"" from your Deck to your hand. If this card is in your GY and you control no monsters: You can Special Summon this card  but banish it when it leaves the field. An Xyz Monster that was Summoned using only WATER monsters as material  including this card on the field  gains this effect.  ● This card cannot be destroyed by battle.  You can only use each effect of ""Right-Hand Shark"" once per turn.",4.0,1500.0,1300.0,Fish,WATER,
71734607,Rikka Petal,Effect Monster,effect,"During your Main Phase: You can take 1 ""Rikka"" monster from your Deck  except ""Rikka Petal""  and either add it to your hand or send it to the GY  also you cannot Special Summon for the rest of this turn  except Plant monsters. During your opponent's End Phase  while this card is in your GY  if you control no monsters or all monsters you control are Plant monsters: You can Special Summon this card. You can only use each effect of ""Rikka Petal"" once per turn.",1.0,0.0,0.0,Plant,WATER,Rikka
132308,Rikka Princess,Effect Monster,effect,"During your Main Phase: You can Special Summon this card from your hand  but while it is face-up in the Monster Zone  you cannot Special Summon monsters  except Plant monsters. When your opponent activates a monster effect  while you control a ""Rikka"" monster (Quick Effect): You can shuffle this card from your hand or GY into the Deck and Tribute 1 Plant monster; negate that effect. You can only use each effect of ""Rikka Princess"" once per turn.",4.0,0.0,0.0,Plant,WATER,Rikka
3828844,Rikka Queen Strenna,XYZ Monster,xyz,"2 Level 4 monsters  You can detach 1 material from this card  then target 1 Plant monster or ""Rikka"" card in your GY; add it to your hand. If this card with Xyz Material is Tributed: You can Special Summon 1 Rank 5 or higher Plant Xyz Monster from your Extra Deck or GY  then you can attach this card to it as material. You can only use each effect of ""Rikka Queen Strenna"" once per turn.",4.0,2000.0,2000.0,Plant,WATER,Rikka
19066538,Roaring Ocean Snake,Fusion Monster,fusion,"""Mystic Lamp"" + ""Hyosube""",6.0,2100.0,1800.0,Aqua,WATER,
57946551,Rock Scales,Effect Monster,effect,"If this card is Special Summoned: You can target 1 other face-up monster on the field; equip that face-up monster to this card. At the start of the Damage Step  if this card battles an opponent's monster with the same Type and Attribute as the Monster Card equipped by this card's effect: You can destroy that opponent's monster. You can only use each effect of ""Rock Scales"" once per turn.",5.0,2100.0,1600.0,Fish,WATER,
1357146,Ronintoadin,Effect Monster,effect,"Cannot be used as a Synchro Material. This card's name becomes ""Des Frog"" while it is on the field. If this card is in your Graveyard: You can banish 1 ""Frog"" monster from your Graveyard; Special Summon this card.",2.0,100.0,2000.0,Aqua,WATER,Frog
39004808,Root Water,Normal Monster,normal,An amphibian capable of calling up a massive tidal wave from the dark seas to wipe out enemy monsters.,3.0,900.0,800.0,Fish,WATER,
66661678,Royal Knight of the Ice Barrier,Effect Monster,effect,"When this card is Tribute Summoned  Special Summon 1 ""Ice Coffin Token"" (Aqua-Type/WATER/Level 1/ATK 1000/DEF 0) in Attack Position to your opponent's side of the field. This Token cannot be Tributed for a Tribute Summon.",5.0,2000.0,2000.0,Warrior,WATER,Ice Barrier
37953640,Royal Swamp Eel,Tuner Monster,effect,If this card is used as a Synchro Material Monster  all the other Synchro Material Monsters must be Fish-Type.,4.0,1700.0,1200.0,Fish,WATER,
63193879,Saber Shark,Effect Monster,effect,Cannot be used as a Synchro Material. Up to twice per turn: You can target 1 Fish-Type monster on the field  then activate 1 of these effects.  ● Increase its Level by 1.  ● Reduce its Level by 1.  You cannot Special Summon any monsters during the turn you activate this effect  except WATER monsters.,4.0,1600.0,1200.0,Fish,WATER,
44877690,Sacred Spirit of the Ice Barrier,Spirit Monster,effect,"This card cannot be Special Summoned. This card returns to the hand during the End Phase of the turn it is Normal Summoned or flipped face-up  unless you control another face-up ""Ice Barrier"" monster. In that case  this card's effect changes to select 1 monster your opponent controls and return it to the hand  instead.",4.0,1600.0,1200.0,Zombie,WATER,Ice Barrier
34456146,Sage of Benevolence - Ciela,Effect Monster,effect,"(This card is always treated as a ""Sky Striker"" card.)  You can discard 1 Spell; Special Summon this card from your hand. You can banish 1 Spell from your GY; give control of this card to your opponent  and if you do  Special Summon 1 ""Sky Striker Ace"" monster from your GY. If this card is destroyed by battle or card effect and sent to the GY: You can target 1 of your banished ""Sky Striker"" Spells; add it to your hand. You can only use each effect of ""Sage of Benevolence - Ciela"" once per turn.",6.0,2200.0,1000.0,Machine,WATER,Sky Striker
15130912,Saion the Vaylantz Archer,Pendulum Effect Monster,effect_pendulum,"[ Pendulum Effect ]  During your Main Phase: You can Special Summon this card to your Main Monster Zone in its same column  also you cannot Special Summon non-""Vaylantz"" monsters for the rest of this turn  except from the Extra Deck. You can only use this effect of ""Saion the Vaylantz Archer"" once per turn. [ Monster Effect ]  If you control this Special Summoned card: You can target 1 Effect Monster on the field; toss a coin and if the result is heads  negate its effects  or if the result is tails  halve its ATK. If this card in the Monster Zone moves to another Monster Zone: You can target 1 card on the field; toss a coin and if the result is heads  destroy it  or if the result is tails  return it to the hand. You can only use each effect of ""Saion the Vaylantz Archer"" once per turn.",4.0,1100.0,1100.0,Spellcaster,WATER,Vaylantz
41705642,Salvage Warrior,Effect Monster,effect,When this card is Tribute Summoned  you can Special Summon 1 Tuner monster from your hand or Graveyard.,5.0,1900.0,1600.0,Warrior,WATER,
64926005,Samurai of the Ice Barrier,Effect Monster,effect,When this face-up Attack Position card is changed to face-up Defense Position: Destroy this card  and if you do  draw 1 card.,4.0,1800.0,1500.0,Warrior,WATER,Ice Barrier
56161953,Scrypton,Effect Monster,effect,"You can banish 1 Cyberse monster from your GY  except ""Scrypton""; Special Summon this card from your hand. If this card is sent to the GY as material for the Link Summon of a Cyberse monster: You can target 1 banished monster; shuffle it into the Deck. You can only use each effect of ""Scrypton"" once per turn.",5.0,1500.0,1500.0,Cyberse,WATER,
53309998,Sea Archiver,Effect Monster,effect,"If a monster is Normal or Special Summoned to a zone a Link Monster points to (except during the Damage Step): You can Special Summon this card from your GY (if it was there when the Summon resolved) or hand (even if not)  but banish it when it leaves the field. You can only use this effect of ""Sea Archiver"" once per turn.",3.0,300.0,2100.0,Cyberse,WATER,
76891401,Sea Dragon Lord Gishilnodon,Synchro Monster,synchro,1 Tuner + 1 Level 3 non-Tuner monster  When a face-up Level 3 or lower monster on the field is sent to the Graveyard  this card's ATK becomes 3000 until the End Phase of this turn.,5.0,2300.0,1800.0,Sea Serpent,WATER,
82114013,Sea Dragoons of Draconia,Pendulum Normal Monster,normal_pendulum,"[ Pendulum Effect ]  When a monster is destroyed by battle: You can Special Summon 1 Normal Monster from your hand. You can only use this effect of ""Sea Dragoons of Draconia"" once per turn. [ Monster Effect ]  ''Silently creeping in from the deep sea  elite black ops marine troops of the Draconia Empire wage an endless battle against the hated Principality of Dinon on the sea's opposite shores.''",3.0,200.0,2100.0,Sea Serpent,WATER,Draconia
71746462,Sea Kamen,Normal Monster,normal,A merciless monster that tears opponents to shreds with razor-like claws.,4.0,1100.0,1300.0,Aqua,WATER,
23659124,Sea King Dragon,Normal Monster,normal,Protected by a tough shell  this master of the sea attacks its enemies with toxic bubbles.,6.0,2000.0,1700.0,Sea Serpent,WATER,
22842214,Sea Lancer,Effect Monster,effect,You can target any number of your banished Fish  Sea Serpent  and Aqua-Type monsters; equip them to this card. This effect can only be used once while this card is face-up on the field. If this face-up card on the field would be destroyed  you can destroy 1 of those cards  instead. This card gains 1000 ATK while equipped with a monster(s) by this effect.,5.0,1300.0,1000.0,Beast-Warrior,WATER,
96334243,Sea Monster of Theseus,Fusion Monster,fusion,2 Tuners,5.0,2200.0,1800.0,Zombie,WATER,
42071342,Sea Serpent Warrior of Darkness,Normal Monster,normal,A warrior who defends the world of the Sea of Darkness. He prides himself on his fighting prowess both on the ground and  of course  in the water.,4.0,1800.0,1500.0,Sea Serpent,WATER,
101203053,Sebek's Sorcerer,Link Monster,link,"2 Effect Monsters  When this card or your monster it points to inflicts battle damage to your opponent: You can gain the same amount of LP. If either player gains LP (even during the Damage Step): You can make each player take 1000 damage. You can only use each effect of ""Sebek's Sorcerer"" once per turn.",,2000.0,,Aqua,WATER,Prophecy
27527047,Secret Guards of the Ice Barrier,Effect Monster,effect,"Face-up ""Ice Barrier"" monsters you control cannot be targeted by effects of your opponent's Effect Monsters.",2.0,100.0,1600.0,Aqua,WATER,Ice Barrier
44686185,Secret Six Samurai - Hatsume,Effect Monster,effect,"You can banish 2 ""Six Samurai"" monsters from your GY and/or face-up from your field  then target 1 ""Six Samurai"" monster in your GY  except ""Secret Six Samurai - Hatsume""; Special Summon it. You can only use this effect of ""Secret Six Samurai - Hatsume"" once per turn. If exactly 1 ""Six Samurai"" monster you control (and no other cards) would be destroyed by card effect  you can banish this card from your GY instead.",3.0,1600.0,1500.0,Warrior,WATER,Secret Six Samurai
